4055,national small tsunami waves reach japan after chile quake small tsunami waves hit northern japan early httpAddress httpAddress,Other Useful Information
4056,usrId jg i m reporting from northern chile after earthquake 8.2 day httpAddress we are well please say a prayer for our httpAddress,Other Useful Information
4057,earthquake ! ml 4.7 offshore tarapaca chile httpAddress,Other Useful Information
4058,another earthquake in httpAddress 7.8 httpAddress httpAddress,Other Useful Information
4059,chile president flees as strong earthquake strikes country httpAddress,Other Useful Information
4060,so if the leader flees how about his pplrt 233livenews chile president flees as strong earthquake strikes country httpAddress,Other Useful Information
4061,new evacuations in chile after major earthquake aftershock httpAddress,Other Useful Information
4062,another earthquake in httpAddress 7.8 httpAddress submitted by stuffonastick to science link 37 comments httpAddress,Other Useful Information
4063,usrId 7.6 aftershock strikes off chile the death toll from a powerful httpAddress earthquake that struck httpAddress usrId,Other Useful Information
4064,skynews chile hit by second powerful earthquake httpAddress,Other Useful Information
4065,earthquake update m 6.1 offshore tarapaca chile magnitude m httpAddress offshore tarapaca chiledate httpAddress httpAddress,Other Useful Information
4066,another earthquake in httpAddress 7.8 httpAddress httpAddress,Other Useful Information
4067,raw 8.0 earthquake strikes chile triggers tsunami for chile peru and httpAddress httpAddress via usrId,Other Useful Information
4068,chile hit by second powerful earthquake httpAddress #shoutnews,Other Useful Information
4069,emsc httpAddress apr 03 07 15 42 utc offshore tarapaca chile httpAddress httpAddress #quake httpAddress,Other Useful Information
4070,chile well prepared for big earthquake httpAddress,Other Useful Information
4071,earthquake m httpAddress 73km sw of iquique chile thursday april 03 DD 06 54 31 utc thursday april 03 httpAddress httpAddress,Other Useful Information
4072,earthquake ! ml 4.4 offshore tarapaca chile httpAddress,Other Useful Information
4073,#reddit another earthquake in httpAddress 7.8 httpAddress httpAddress,Other Useful Information
4074,another earthquake in httpAddress 7.8 httpAddress httpAddress,Other Useful Information
4075,usrId it s really hazy and everything s covered in dust ! still nothing like as bad as tsunami alerts in chile and peru !,Other Useful Information
4076,chile earthquake DD amazing footages terremoto en chile ! tsunami httpAddress via usrId,Other Useful Information
4077,local students in chile share experiences from earthquake httpAddress,Other Useful Information
4078,chile earthquake unleashes tsunami and sensors track it yahoonews httpAddress,Other Useful Information
4079,chile s earthquake status as of april 3 DD gmt 8 httpAddress,Other Useful Information
4080,httpAddress earthquake struck off coast of chile tonight usrId says day after 8.2 quake rocked httpAddress,Other Useful Information
4081,a powerful 7.6 magnitude earthquake has rocked northern chile just over DD hours after an 8.2 tremor killed six httpAddress,Other Useful Information
4082,#ghdiplomat earthquakes in #chile amp ; small tsunami in #japan are underlying the seriousness of the #un s DD #climatechange predictions,Other Useful Information
4083,shared earthquake 40km sw of iquique chile at DD april httpAddress,Other Useful Information
4084,earthquake m 4.8 96km wnw of iquique chile dyfi ? itime2014 04 03 08 28 51 utc2014 04 03 03 28 51 httpAddress httpAddress,Other Useful Information
4085,chile earthquake rush to evacuate coast after tsunami warning live httpAddress president bachelet said she httpAddress httpAddress,Other Useful Information
4086,ph monitoring tsunami threat from chile quake httpAddress,Other Useful Information
4087,earthquake chile terremoto en santiago tsunami alert quake live httpAddress via usrId,Other Useful Information
4088,#chile struck by 7.8 #aftershock followign massive 8.2 httpAddress httpAddress,Other Useful Information
4089,8.2 magnitude earthquake in chile ! httpAddress httpAddress #chile,Other Useful Information
4090,fukushima japan earthquake coming ? new ufos another chile earthquake april2 DD D httpAddress httpAddress #japan,Other Useful Information
4091,emsc httpAddress apr 03 09 08 58 utc offshore tarapaca chile httpAddress httpAddress #quake httpAddress,Other Useful Information
4092,aftershock rocks chile one day after deadly earthquake httpAddress,Other Useful Information
4093,residents who have fled their homes sleep on an open street in iquique #chile after a powerful #earthquake measu httpAddress,Other Useful Information
4094,chile earthquake aftershock and httpAddress the worst is yet to come,Other Useful Information
4095,#chileearthquake #aftershock httpAddress #chileearthquakeandtsunami,Other Useful Information
4096,usa news httpAddress hot news DD chile earthquake massive chile earthquake may not be the quotbig onequot janinebucks okla,Other Useful Information
4097,the aftermath of chile s earthquake httpAddress httpAddress,Other Useful Information
4098,amateur radio chile earthquake ham radio activation the radio club de chile has been httpAddress httpAddress #hamradio #hamr,Other Useful Information
4099,tech talk with chenda ngak chile earthquake do bigger tremors loom ? httpAddress,Other Useful Information
4100,the aftermath of chile s earthquake httpAddress,Other Useful Information
4101,watch northern chile hit by new httpAddress httpAddress,Other Useful Information
4102,could a larger earthquake await chile ? la times httpAddress la respuesta httpAddress #nowonder httpAddress,Other Useful Information
4103,8.2 earthquake in httpAddress httpAddress,Other Useful Information
4104,there have been #57 #earthquakes of magnitude 4.5 or higher in #chile this #week alexis c . madrigal the atlantic httpAddress,Other Useful Information
4105,natural disaster and democratic legitimacy the public opinion consequences of chiles DD earthquake and tsunami httpAddress,Other Useful Information
4106,usrId yes in chile south of iquique iquique was a peruvian city until 1879 yes it was dangerous i had tsunami warning,Other Useful Information
4107,watch httpAddress earthquake rocks chile surrounding countries #newslocker httpAddress,Other Useful Information
4108,chile earthquake chile its geography climate earthquakes government social condition mineral and agricultural httpAddress,Other Useful Information
4109,ml 3.9 offshore tarapaca chile magnitudeml httpAddress tarapaca chiledate time2014 04 03 httpAddress httpAddress,Other Useful Information
4110,more than DD aftershocks have shaken northern #chile since 8.2 httpAddress largest recorded at 7.6 last night #chileearthquake,Other Useful Information
4111,#dutchsinse he breaks down the info D u httpAddress second large httpAddress #earthquake strikes chile httpAddress,Other Useful Information
4112,live earthquake chile lastnight,Other Useful Information
4113,chile earthquake moment caught oncamera httpAddress,Other Useful Information
4114,more than DD aftershocks have shaken northern #chile since 8.2 httpAddress largest recorded at 7.6 last night #chileearthquake,Other Useful Information
4115,"another earthquake in chile last night
my god ! #chileearthquake #chile #prayforchile",Other Useful Information,2014_chile_eq_en
4116,chile earthquake do bigger tremors loom ? httpAddress,Other Useful Information
4117,#usa httpAddress # #powerful httpAddress #earthquake #off #chile #kills #at #least 5 #forces #evacuations #a #powerful #mag,Other Useful Information
4118,usrId usrId not only #latinamerica but this complete hemisphere needs to unite on httpAddress from #canada to #chile #mexico amp ; #pr,Other Useful Information
4119,video first images from 8.3 earthquake in chile httpAddress #tcot #tlot #tgdn,Other Useful Information
4120,usrId did you hear that most likely california is going to have an earthquake soon because of the one in chile ?,Other Useful Information
4121,chile earthquake do bigger tremors loom ? httpAddress via usrId,Other Useful Information
4122,earthquake in chile httpAddress via usrId,Other Useful Information
4123,new #crisismapping tool from usrId using aidr to collect and analyze tweets from #chileearthquake httpAddress,Other Useful Information
4124,watch animation of the tsunami resulting from earthquake in northern chile on D april 20D4 httpAddress,Other Useful Information
4125,chile earthquake strict building rules may keep death toll low httpAddress,Other Useful Information
4126,#chile #earthquake shakes up world #copper prices fox news latino httpAddress via usrId #industrial #metals #mining,Other Useful Information
4127,chilling tsunami animation of the earthquake in chile by the ptwc httpAddress,Other Useful Information
4128,#aluminum rises to DD high on global supply concerns via usrId httpAddress,Other Useful Information
4129,northern chile 8.2 earthquake strikes in mall httpAddress via usrId,Other Useful Information
4130,abc world news now deadly earthquake strikes off chile s coast watch httpAddress,Other Useful Information
4131,elf chile 8.2 earthquake chile 8.2 earthquake fresh off the heels of a httpAddress earthquake off the httpAddress httpAddress,Other Useful Information
4132,earthquake and tsunami in chile effective regional cooperation and preparedness saves httpAddress un educational httpAddress,Other Useful Information
4133,the #iquique #chile #earthquake from the perspective of a paleoseismologiest httpAddress,Other Useful Information
4134,usrId strict building codes and earthquake preparedness saves lives and livelihoods #chileearthquake httpAddress,Other Useful Information
4135,phew gt ; #earthquake in #chile spares #wine regions httpAddress via usrId usrId,Other Useful Information
4136,#israeli startup helps save lives after earthquake #chileearthquake amp ; #chiletsunami via usrId usrId httpAddress,Other Useful Information
4137,yesterday chile got another earthquake poor people from arica chile luckily they didn t have a httpAddress,Other Useful Information
4138,earthquake reports re httpAddress 120km wnw of iquique chile httpAddress 99km wsw of iquique chile httpAddress httpAddress,Other Useful Information
4139,#chile has over the years implemented strict building codes and rigorous evacuation plans experts httpAddress,Other Useful Information
4140,world earthquake today in chile,Other Useful Information
4141,earthquake D mb DD km wsw of iquique chile earthquakes today httpAddress,Other Useful Information
4142,earthquake off the coast of chile a powerful 8.2 magnitude earthquake hit the chile coast late april D that httpAddress httpAddress,Other Useful Information
4143,photo residents camp out near iquique after a second earthquake measuring 7.6 rocks northern chile httpAddress,Other Useful Information
4144,residents camp out near iquique after a second earthquake measuring 7.6 rocks northern chile photo via afp httpAddress,Other Useful Information
4145,rt usrId photo residents camp out near iquique httpAddress httpAddress #chile #pacific #earthquake #tsunami #antofagasta via usrId,Other Useful Information
4146,earthquake off the coast of chile a powerful 8.2 magnitude earthquake hit the chile coast late april D that caused a small httpAddress ..,Other Useful Information
4147,via usrId photo residents camp out near iquique after a second earthquake measuring 7.6 rocks northern chile httpAddress,Other Useful Information
4148,another powerful quake rocks northern #chile nbc httpAddress httpAddress usrId DD stories i hope you re safe,Other Useful Information
4149,a large earthquake of magnitude 8.5 strikes off chiles coast a large earthquake of magnitude 8.5 strikes httpAddress httpAddress,Other Useful Information
4150,rt usrId wow x 2 davidmarcus wow from usrId terrifying animation shows how chile tsunami spread pacific httpAddress,Other Useful Information
4151,httpAddress DD chile earthquake chile earthquake httpAddress quake sparks fires kills six tsu httpAddress,Other Useful Information
4152,wa needs a seismic school retrofit program httpAddress another warning for the northwest from chiles earthquake hot zone httpAddress,Other Useful Information
4153,abc world news now deadly earthquake strikes off chile s coast watch httpAddress,Other Useful Information
4154,abc world news now deadly earthquake strikes off chile s coast watch httpAddress,Other Useful Information
4155,chile earthquake charlie rose sebastin piera president of chile httpAddress a look at iran september 23 2010 dvd http httpAddresshttpAddresst . cohttpAddress4xwitg8fmg,Other Useful Information
4156,massive 8.0 earthquake strikes off the coast of chile a massive 8.0 magnitude earthquake according to the httpAddress httpAddress,Other Useful Information
4157,strange events before amp ; after earthquakes after the DD chile earthquake people started to httpAddress httpAddress #,Other Useful Information
4158,chile begins assessing damage from earthquake httpAddress httpAddress #chile,Other Useful Information
4159,chile earthquake how loss of life damage was minimized httpAddress,Other Useful Information
4160,terrifying animation shows how chile s tsunami took over the entire pacific .. wired httpAddress,Other Useful Information
4161,earthquake off the coast of chile httpAddress,Other Useful Information
4162,httpAddress off the coast of tarapaca chile depth httpAddress apr 05 DD 02 05 45 utc apr 04 DD 21 05 45 at epicenter httpAddress,Other Useful Information
4163,chile earthquake how loss of life damage was minimized httpAddress,Other Useful Information
4164,httpAddress off the coast of tarapaca chile depth httpAddress apr 05 DD 02 17 18 utc apr 04 DD 21 17 18 at epicenter httpAddress,Other Useful Information
4165,mb 4.3 off coast of tarapaca chile magnitudemb httpAddress coast of tarapaca chiledate httpAddress httpAddress,Other Useful Information
4166,emsc httpAddress apr 05 02 17 18 utc off coast of tarapaca chile httpAddress httpAddress #quake httpAddress,Other Useful Information
4167,earthquake off the coast of chile photos the big picture httpAddress,Other Useful Information
4168,terrifying animation shows how chiles tsunami took over the entire pacific ocean science wired httpAddress,Other Useful Information
4169,felt #earthquake httpAddress strikes DD km nw of #santiago #chile DD min httpAddress please report to httpAddress httpAddress,Other Useful Information
4170,powerful earthquake hits off chile triggers tsunami disaster declared httpAddress httpAddress httpAddress #chile,Other Useful Information
4171,qu ? bec can montr ? al httpAddress DD chile earthquake how loss of life damage was minimized chile earthquake vanisan24 #and,Other Useful Information
4172,terrifying animation shows how chiles tsunami took over the entire pacific httpAddress,Other Useful Information
4173,chile s president michelle bachelet among evacuees as second earthquake hits video httpAddress httpAddress #chile,Other Useful Information
4174,woman walks with children amid debris after earthquake and tsunami hit northern chile httpAddress,Other Useful Information
4175,new massive httpAddress httpAddress httpAddress 6.2 quakes strike chile after monster 8.3 tsunami alert httpAddress httpAddress,Other Useful Information
4176,powerful earthquake strikes off chile triggers tsunami breaking news D april D014 httpAddress httpAddress #chile,Other Useful Information
4177,inmates escape after chile earthquake httpAddress,Other Useful Information
4178,inmates escape after chile earthquake cnn s rafael romo reports on the aftermath of an httpAddress httpAddress httpAddress,Other Useful Information
4179,4.8 magnitude httpAddress DD km from #iquique tarapaca chile httpAddress,Other Useful Information
11181,itvnews witness to nepal #earthquake tells itvnews it was terrifying httpAddress,Other Useful Information
11182,live nepal cabinet meets to seek foreign help DD feared dead after massive quake via usrId httpAddress,Other Useful Information
11183,so distressing httpAddress,Other Useful Information
11184,a crucial tool in a situation like #nepalquake httpAddress people httpAddress httpAddress,Other Useful Information
11185,people with vehicles please move out to support in areas near durbar httpAddress #nepal,Other Useful Information
11186,devastating pictures of #nepalearthquake httpAddress,Other Useful Information
11187,newearthquake 5.0 earthquake 31km nnw of nagarkot httpAddress apr DD 15 15 at epicenter 21m ago depth httpAddress httpAddress,Other Useful Information
11188,magnitude 7.9 quake with epicentre between pokhara and kathmandu felt as far away as delhi and httpAddress httpAddress,Other Useful Information
11189,panic in nepal strong quake hits capital causing major damage injuries,Other Useful Information
11190,earthquake httpAddress kathmandu not clear what the extent of the damage is yet httpAddress,Other Useful Information
11191,#this is the #helpline for #nepal earthquake click on this post httpAddress,Other Useful Information
11192,massive earthquake in httpAddress indian embassy helpline 977 9851107021 DD strong aftershocks still being httpAddress #indiawithnepal,Other Useful Information
11193,chpsre chpsre chpsre rtlastquake felt #earthquake httpAddress strikes DD km e of #kathmandu #nepal DD min httpAddress please httpAddress,Other Useful Information
11194,have directed officials to take steps to restore communication lines in indo nepal border communications amp ; httpAddress httpAddress,Other Useful Information
11195,earthquake severe damage to httpAddress tragic loss of httpAddress httpAddress,Other Useful Information
11196,pm usrId speaks to pm of #nepal httpAddress,Other Useful Information
11197,strong earthquake strikes nepal bbc news httpAddress,Other Useful Information
11198,treat with extreme caution but this is the usgs auto estimate of #nepal casualty probabilities httpAddress,Other Useful Information
11199,west bengal civic polls live voting disrupted due to nepal earthquake httpAddress #india httpAddress,Other Useful Information
11200,whole lot of shaking going on httpAddress,Other Useful Information
11201,relief teams taken off for nepal right httpAddress usrId taken very swift httpAddress,Other Useful Information
11202,httpAddress earthquake hits densely populated area of nepal httpAddress #shoutnews,Other Useful Information
11203,"share helpline numbers of the indian embassy in httpAddress DD 977 9851135141
some other helpline httpAddress httpAddress",Other Useful Information,2015_nepal_eq
11204,nepal earthquake tremors felt in various parts of chennai thanthi tv tamiltwin httpAddress,Other Useful Information
11205,after nepal earthquake pm narendra modi calls emergency meet DD developments a powerful 7.9 magnitude earthquake struck nepal on httpAddress,Other Useful Information
11206,transparent direct #nepalquake DD #earthquake relief httpAddress via usrId,Other Useful Information
11207,usrId hi it s amy from the bay here could you give me a follow back so i can speak to you about the nepal amp ; local people involved ?,Other Useful Information
11208,key facts about nepal site of httpAddress quake httpAddress #headlinenews #news,Other Useful Information
11209,these pics tell pain of nepal earthquake gt ; httpAddress lt ; plz rt amp ; share their httpAddress #candlelightvigil,Other Useful Information
11210,#nepalquake biggest in almost DD years #nepal,Other Useful Information
11211,tragedy in nepal httpAddress,Other Useful Information
11212,big b expresses shock over nepal quake reminisces mahaan shoot httpAddress httpAddress #humaaqureshi1,Other Useful Information
11213,was in plane during #kathmandu httpAddress lnded aftr DD min httpAddress now in open area in httpAddress aftershocks continue,Other Useful Information
11214,durbar square ??! usrId first apparently authentic video seen from #nepalquake httpAddress #prayfornepal,Other Useful Information
11215,big b expresses shock over nepal quake reminisces mahaan shoot httpAddress httpAddress #aslianushka,Other Useful Information
11216,shelterbox a 7.9 magnitude earthquake has hit DD miles east of pokhara httpAddress httpAddress #restlessearth,Other Useful Information
11217,red cross aids in rescue efforts in nepal httpAddress,Other Useful Information
11218,nepal helpline numbers please share httpAddress,Other Useful Information
11219,usrId usrId usrId if our teams r camping in nepal home minister amp ; team shud camp in indian areas usrId usrId,Other Useful Information
11220,httpAddress earthquake strikes nepal damage reported video httpAddress,Other Useful Information
11221,destruction everywhere #nepalquake httpAddress,Other Useful Information
11222,usrId opens DD hour control room for queries regarding tragic httpAddress numbers 91 DD DD 2DD3 91 DD DD 4104 91 DD DD DD,Other Useful Information
11223,usrId these rss will help quietly amp ; httpAddress httpAddress,Other Useful Information
11224,rss swaymsevaks from up bihar will be heading to nepal to help in rescue httpAddress #earthquake,Other Useful Information
11225,"breaking httpAddress india bangladeshmei 7 . D shiddat ka zalzala khatmando me D manzila building gir gaye DD afrad dub gaye
by bagan lashari",Other Useful Information,2015_nepal_eq
11226,happy rt usrId #nepalquake deep kumar upadhyay nepal s ambassador to india says httpAddress httpAddress,Other Useful Information
11227,happy rt usrId emergency helpline numbers for #nepalquake httpAddress httpAddress httpAddress,Other Useful Information
11228,rc engaged in search and rescue operations in #nepal #nepalquake httpAddress,Other Useful Information
11229,breaking news major earthquake in nepal leaves hundreds dead httpAddress,Other Useful Information
11230,powerful earthquake hits kathmandu httpAddress,Other Useful Information
11231,roadside hospitals #earthquake #nepal httpAddress,Other Useful Information
11232,#nepalquake #emergency contact numbers httpAddress,Other Useful Information
11233,saw the 7.9 magnitude #earthquake in httpAddress in ponds seemed like httpAddress,Other Useful Information
11234,more aftershocks #earthquake #nepal #nepal #nepalquake,Other Useful Information
11235,frequent amp ; strong aftershocks in the kathmandu region following the 7.9 #earthquake earlier httpAddress #nepalquake httpAddress,Other Useful Information
11236,rtlastquake rt eurogeosciences last year katerav wrote on kathmandu s earthquake nightmare httpAddress,Other Useful Information
11237,#emergency #earthquake #hospitals #ngo amp ; DD helplines dwnld india1st such app at httpAddress rt httpAddress,Other Useful Information
11238,usrId modi first visit was nepal after becoming pm others countries should be careful i guess,Other Useful Information
11239,talking to interior minister in #nepal to get latest on unfolding tragedy and #earthquake usrId,Other Useful Information
11240,as one of the greatest disaster hit nepal with destruction of human httpAddress #pray for nepal,Other Useful Information
11241,rt neelakandans1 it is indeed a great gesture by #india httpAddress,Other Useful Information
11242,emergency contact numbers #earthquake #nepal httpAddress,Other Useful Information
11243,chpsre rtlastquake rt eurogeosciences last year katerav wrote on kathmandu s earthquake nightmare httpAddress,Other Useful Information
11244,big earthquake innepal httpAddress,Other Useful Information
11245,very relieved to report that the children and staff at our residential facilities in kathmandu are safe and httpAddress httpAddress,Other Useful Information
11246,usrId what the httpAddress this is not httpAddress what the httpAddress,Other Useful Information
11247,news nepal earthquake httpAddress tremor hits kathmandu everest httpAddress httpAddress,Other Useful Information
11248,news nepal hit by 7.5 magnitude earthquake httpAddress httpAddress,Other Useful Information
11249,latest satellite image of nepali sky httpAddress auto tweet #weather httpAddress #satimage #nepal httpAddress,Other Useful Information
11250,usrId this is not kathmandu httpAddress it is thailand last httpAddress pls correct httpAddress,Other Useful Information
11251,severe quake hitsnepal httpAddress,Other Useful Information
11252,"powerful quake hits nepal ; heavy damage expected sat 2015 04 25 10 08
katmandu nepal a strong httpAddress httpAddress",Other Useful Information,2015_nepal_eq
11253,massive damage at nepal quake epicentre massive damage at nepal quake httpAddress DD minutes httpAddress a httpAddress httpAddress,Other Useful Information
11254,#suryaray #india DD aftershocks jolt nepal after massive earthquake nepal was jolted by fourteen httpAddress usrId,Other Useful Information
11255,usrId usrId this is httpAddress it is not kathmandu httpAddress please httpAddress httpAddress,Other Useful Information
11256,mt usrId #video residents of kathmandu scurry and damage is seen after powerful earthquake rocks #nepal httpAddress,Other Useful Information
11257,it s highly unfortunate D see da destruction brought about by today s #earthquakes in httpAddress the tremors were also felt from delhi D kolkata,Other Useful Information
11258,rt chpsre rtlastquake felt #earthquake httpAddress strikes DD km n of #khndbri #nepal DD min ago from httpAddress httpAddress,Other Useful Information
11259,the world s strongest earth #japanquakes since 1900 a httpAddress earth #japanquake shook nepal s httpAddress #tel4rent,Other Useful Information
11260,usrId rt signif damage in #kathmandu after #earthquake hits #nepal httpAddress httpAddress my #peacecorps host country,Other Useful Information
