17370,believe it or not napa county is one of california s httpAddress the quake will only make it httpAddress httpAddress,Other Useful Information
17373,earthquake httpAddress mag D km se of san fernando california httpAddress #earthquake #quake,Other Useful Information
17374,rt usrId sizable aftershock from napa earthquake rattles residents httpAddress,Other Useful Information
17375,usgs reports a httpAddress #earthquake 7km sw of napa california on httpAddress 19 12 28 utc httpAddress #quake,Other Useful Information
17376,rt usrId little known fault suspected in northern california quake httpAddress via usrId,Other Useful Information
17377,rt usrId meadowbrook lane in napa skaters find upside to quake httpAddress video httpAddress pic by jeremy carroll httpAddress,Other Useful Information
17378,northern california earthquake is the strongest in DD years editors note are httpAddress usrId,Other Useful Information
17380,6.0 earthquake recorded in napa httpAddress wine httpAddress my friend and her husband were not so httpAddress,Other Useful Information
17382,rt usrId httpAddress DD northern california earthquake is the strongest in DD years #earthquaketoday cnn the,Other Useful Information
17384,rt usrId #breaking usgs 6.0 magnitude #earthquake shakes northern california httpAddress,Other Useful Information
17385,thanks to the napa earthquake explained the geo cultural differences in winecellar design between france vs . httpAddress many times httpAddress,Other Useful Information
17386,rt usrId napa earthquake lessons how to prepare your business for disaster httpAddress #smallbiz #napaquake httpAddress,Other Useful Information
17387,rt usrId watch live get the latest details on the south napa earthquake on abc7 news at DD httpAddress watch now httpAddress,Other Useful Information
17388,napa earthquake s timing left many fumbling in dark httpAddress,Other Useful Information
17390,rt usrId safety improvements to historic buildings helped save lives in napa earthquake experts httpAddress httpAddress httpAddress,Other Useful Information
17393,httpAddress earthquake is california bay areas strongest since loma prieta httpAddress,Other Useful Information
17398,inquiries about earthquake insurance are likely to spike after the california earthquake httpAddress via usrId,Other Useful Information
17401,former top nrc inspector says shut diablo canyon california due to earthquake threats httpAddress via usrId,Other Useful Information
17402,#mp california hit by strong httpAddress quake via the news international httpAddress,Other Useful Information
17403,due to earthquake in california bp will raise gas prices,Other Useful Information
17407,rt usrId usa httpAddress DD earthquake northern california rocked by magnitude 6.0 earthquake nicoleewayne washingto,Other Useful Information
17408,california earthquake 2014 american canyon epicenter of 6.0 quake httpAddress,Other Useful Information
17409,napa earthquake woke this many jawbone wearers httpAddress via usrId interesting but im creeped out that they track whn you slp,Other Useful Information
17410,rt usrId salsaquake ! bring the chips rt usrId what the strongest earthquake in DD years did to one shop in california http,Other Useful Information
17414,httpAddress earthquake in chile httpAddress 6.0 earthquake in northern california early this httpAddress and now 7.0 earthquake in peru !,Other Useful Information
17415,earthquake magnitude D in ca . it s usual but damage is small in httpAddress usa must think safety of httpAddress #earthquake,Other Useful Information
17416,what napa looks like after the quake a strong earthquake rocked northern california early sunday morning httpAddress httpAddress,Other Useful Information
17417,4 northern california earthquake blue collar vallejo hit httpAddress story by usrId #napaquake httpAddress #gatebreakers,Other Useful Information
17420,waiting for the big one in california 6.0 #earthquake httpAddress,Other Useful Information
17423,what the napa earthquake means for wine lovers httpAddress,Other Useful Information
17426,rt usrId typical california skating the earthquake fault lines httpAddress,Other Useful Information
17428,earthquake rattles northern california httpAddress,Other Useful Information
17431,rt usrId meadowbrook lane in napa skaters find upside to quake httpAddress video httpAddress pic by jeremy carroll httpAddress,Other Useful Information
17433,#earthquake #sismo m 1.4 6km nw of the geysers california time2014 08 26 22 42 04 utc2014 08 26 15 42 04 httpAddress httpAddress,Other Useful Information
17435,rt usrId billions of dollars of wine rocked in california earthquake httpAddress,Other Useful Information
17436,rt usrId #oklahoma just passed california as the most #earthquake prone state in the country httpAddress lt ; lt ; blows my mind !,Other Useful Information
17439,what fitness trackers revealed about the south napa httpAddress on #theneeds #technology httpAddress,Other Useful Information
17440,rt usrId england gbr grimsby httpAddress breaking news DD california earthquake california earthquake wine country clears,Other Useful Information
17441,rt usrId #earthquake #sismo m 1.0 4km nw of the geysers california time2014 08 27 03 45 05 utc2014 08 26 20 45 05 httpAddress httpAddress,Other Useful Information
17446,south napa earthquake cracks open new fears of the big one httpAddress #truth #infowars,Other Useful Information
17447,rt usrId august 25 2014 northern california 6.0 quake linked to decades of overpumping groundwater ? los angeles httpAddress ..,Other Useful Information
17449,rt usrId a 6.1 earthquake hit near napa california early this httpAddress httpAddress,Other Useful Information
17450,napas 6.0 rumbler brings up another queasy topic earthquake insurance in earthquake prone california a httpAddress httpAddress,Other Useful Information
17453,#video dramatic moments 6.1 #california #earthquake in westin verasa #napa DD DD DD httpAddress #napaquake,Other Useful Information
17454,wow ! more than just spilled wine rt usrId photos reveal damage after napa earthquake httpAddress,Other Useful Information
17456,napa earthquake as mapped by social media posts cnet napa earthquake as mapped by social .. httpAddress #smm #socialmedia,Other Useful Information
17458,#earthquake m httpAddress northern california httpAddress,Other Useful Information
17461,expert urges california nuclear plant closure over earthquake threat former lead inspector for diablo canyon .. httpAddress,Other Useful Information
17464,rt usrId a 3.9 magnitude earthquake occurred httpAddress wnw of american canyon httpAddress details httpAddress map http,Other Useful Information
17468,losses from california quake could top 1 billion new york times new york timeslosses from california httpAddress httpAddress,Other Useful Information
17469,rt usrId northern california braces for aftershocks after magnitude 6.0 earthquake fox news #preppernews httpAddress,Other Useful Information
17470,#juniororteqa napa earthquake hastens calls for warning system napa earthquake .. httpAddress #juniororteqa,Other Useful Information
17471,napa quake #poorcar #california #earthquake httpAddress,Other Useful Information
17473,rt usrId california s napa county rattled by a httpAddress aftershock after an earthquake over the weekend httpAddress,Other Useful Information
17477,rt usrId httpAddress DD state of emergency declared after california earthquake #earthquake jerry brown declared a,Other Useful Information
17478,biggest quake in DD years shakes california httpAddress prophecy fulfilled httpAddress httpAddress via usrId,Other Useful Information
17479,#usaheadlines cleanup efforts underway after major earthquake in california httpAddress,Other Useful Information
17482,massachusetts usa lowell breaking news DD earthquake napa earthquake of DD httpAddress httpAddress via usrId,Other Useful Information
17486,each day after sunday s #napaquake seems to uncover new damage or new httpAddress the latest up next at 11 . watch httpAddress via,Other Useful Information
17489,small quake strikes off southern california httpAddress,Other Useful Information
17491,quake m 1.3 1km ene of the geysers california,Other Useful Information
17492,california wine country quake losses seen in the billions napa httpAddress reuters a strong earthquake that httpAddress httpAddress,Other Useful Information
17493,i wish that gay earthquake in california had killed all the transgendered people,Other Useful Information
17495,rt usrId new post on the napa valley quake and the nature of the plate boundary in httpAddress httpAddress,Other Useful Information
17501,rt usrId thousands of brick buildings in california are still not retrofitted and are in danger of collapse in an earthquake httpAddress,Other Useful Information
17502,how the napa earthquake affected bay area sleepers httpAddress,Other Useful Information
17504,the latest on damaging earthquake in california new york news httpAddress,Other Useful Information
17505,rt usrId what fitness trackers revealed about the south napa httpAddress on #theneeds #technology httpAddress,Other Useful Information
17510,questions and answers about california earthquake by terry tang associated press a httpAddress httpAddress httpAddress,Other Useful Information
17512,california earthquake strikes san francisco bay area httpAddress,Other Useful Information
17514,rt usrId california in one httpAddress mt usrId napa skaters finding upside to quake httpAddress photo from jeremy carroll http,Other Useful Information
17515,california residents see mysterious lights flash in the sky during earthquake naturalnews when a magnitude httpAddress httpAddress,Other Useful Information
17517,rt usrId can news httpAddress hot news DD earthquake today northern california earthquake the strongest in DD years,Other Useful Information
17518,#usaheadlines cleanup efforts underway after major earthquake in california httpAddress,Other Useful Information
17520,police reveal suspect in northern california httpAddress howard stern ! httpAddress,Other Useful Information
17523,jawbone looks at up data to see how many were woken up by the napa earthquake httpAddress #tech,Other Useful Information
17524,quake is major test for hard luck california city california earthquake marks first major test of hard luck httpAddress httpAddress,Other Useful Information
17526,rt usrId the napa earthquake woke this many jawbone up wearers httpAddress,Other Useful Information
17531,jawbone looks at up data to see how many were woken up by the napa earthquake httpAddress via usrId,Other Useful Information
17532,news httpAddress quake to hit northern california since httpAddress double meanings have never been this httpAddress,Other Useful Information
17533,emergency mgmt earthquake in napa httpAddress leaves widespread damage httpAddress,Other Useful Information
17535,if affected by #napaquake usrId has these tips to help prevent post quake fires httpAddress,Other Useful Information
17537,rt usrId california usa costa mesa httpAddress #earthquake DD strong earthquake shakes bay area in california earthquake,Other Useful Information
17538,skaters rip on california terrain transformed by earthquake after what has been called the httpAddress httpAddress #trending #news,Other Useful Information
17539,rt usrId a 3.2 magnitude earthquake occurred httpAddress sw of napa httpAddress details httpAddress map httpAddress,Other Useful Information
17541,usrId usrId the good news out of napa valley no boxed wine was damaged in the httpAddress the bad news no boxed wine was damaged,Other Useful Information
17543,rt usrId a 1.1 magnitude earthquake occurred httpAddress ese of wrightwood httpAddress details httpAddress map httpAddress,Other Useful Information
17547,for those interested here s video i took yesterday of quake damage in downtown httpAddress you won t see this on the httpAddress httpAddress,Other Useful Information
17548,video napa earthquake a big blow to california wine industry tyler dahl looks over a 16 00 barrel of httpAddress httpAddress,Other Useful Information
17551,rt usrId data from jawbone up bands showing effects of napa earthquake on sleep patterns httpAddress,Other Useful Information
17552,cal land west of napa moved 2 nnw rt usrId update on the magnitude D south napa earthquake of august 24 DD httpAddress,Other Useful Information
17553,rt usrId 6.0 magnitude earthquake hits northern httpAddress httpAddress skaters finding upside to quake httpAddress httpAddress,Other Useful Information
17554,a look at earthquake s impact on california region httpAddress,Other Useful Information
17556,rt usrId images from northern california where a powerful earthquake struck sunday httpAddress httpAddress photo ap httpAddress,Other Useful Information
17557,#rt #ipad #iphone video california shaken by earthquake httpAddress #app httpAddress,Other Useful Information
17559,earthquake m httpAddress northern california tuesday august 26 DD 00 02 34 utcmonday august 25 DD 05 02 34 pm at epicenterdepth httpAddress,Other Useful Information
17561,napa earthquake measured in waking rates httpAddress,Other Useful Information
17563,jawbone up data shows how many people woke up during sunday s napa earthquake the verge httpAddress,Other Useful Information
17566,strongest earthquake in DD years hits northern california httpAddress,Other Useful Information
17568,scientists scramble to map previously unknown fault that caused napa quake sunday s 6.0 magnitude earthquake in napa california httpAddress,Other Useful Information
17569,cool graph at #kdd2014 of people awake at hours of night as napa earthquake happened measured by jawbone httpAddress httpAddress,Other Useful Information
17570,rt usrId hey kron this smart car tipping photo is not from today s napa httpAddress httpAddress,Other Useful Information
17571,rt usrId state of emergency as quake hits california httpAddress,Other Useful Information
17572,letyouknow california begins quake clear up workers assess damage and begin to clear .. httpAddress httpAddress,Other Useful Information
17575,northern california rattled by httpAddress earthquake ; governor .. httpAddress,Other Useful Information
17576,rt usrId at least DD aftershocks have hit napa county california since sunday s httpAddress quake httpAddress http,Other Useful Information
17577,rt usrId a 3.3 magnitude earthquake occurred httpAddress ssw of san pedro httpAddress details httpAddress map httpAddress,Other Useful Information
17578,rt usrId photos powerful earthquake shakes northern california httpAddress httpAddress,Other Useful Information
17583,rt usrId alabama usa birmingham httpAddress breaking news DD earthquake state of emergency declared after california eart,Other Useful Information
17585,rt usrId california in one httpAddress mt usrId napa skaters finding upside to quake httpAddress photo from jeremy carroll http,Other Useful Information
17586,rt usrId abc7 news special napa earthquake coverage starting at 10pm continuing until httpAddress #southnapaquake #quake #preparenorca,Other Useful Information
17591,sony targeted by cyber criminals ; california quake highlights insurance risks sony is the latest big name httpAddress httpAddress,Other Useful Information
17592,rt usrId expert urges california nuclear plant closure over earthquake threat cbs news httpAddress usrId usrId,Other Useful Information
17597,#usaheadlines northern california quake no way to know when next one will hit httpAddress,Other Useful Information
17598,#earthquake m httpAddress northern california august 26 DD 17 56 51 gmt httpAddress,Other Useful Information
17600,california winemakers cleaning up after quake,Other Useful Information
17605,tips for #business in #crisis management planning in light of #napa httpAddress httpAddress,Other Useful Information
17607,rt usrId usa httpAddress scores of aftershocks from napa earthquake felt more on the way usa officials have warn,Other Useful Information
17609,rt usrId this was published before today s httpAddress california #drought may mean more #earthquakes httpAddress via,Other Useful Information
17612,skaters make best of napa earthquake by shredding buckled streets to quote jurassic park s esteemed httpAddress httpAddress,Other Useful Information
17615,#wine #napaearthquake strong california quake shakes famed wine country httpAddress via usrId,Other Useful Information
17617,rt usrId connecticut usa bridgeport httpAddress #earthquake DD scores of aftershocks from napa earthquake felt more,Other Useful Information
17618,skaters turn damaged street into ramp after ca httpAddress when life gives you lemons make a skateboard httpAddress httpAddress,Other Useful Information
17621,vickydnguyen meadowbrook lane in napa skaters finding upside to quake httpAddress photo from #nbcbayarea .. httpAddress,Other Useful Information
17622,the napa earthquake amp ; earth ripples for an inner shift httpAddress,Other Useful Information
17629,rt usrId earthquake rocks northern california httpAddress,Other Useful Information
17632,napa earthquake damage insurance losses could hit 4b httpAddress #wine #winery,Other Useful Information
17634,usrId city of los angeles california hollywood preparete repent for the great earthquake prophesied shaloom httpAddress,Other Useful Information
17636,#usaheadlines cleanup efforts underway after major earthquake in california httpAddress,Other Useful Information
17640,#tech skaters make best of napa earthquake by shredding buckled streets httpAddress #onlireeks,Other Useful Information
17641,powerful earthquake rattles northern california httpAddress sale httpAddress #news,Other Useful Information
17643,rt usrId #winemakers r surveying the damage following the #napaquake gt ; usrId usrId httpAddress httpAddress,Other Useful Information
17645,new post jawbone looks at up data to see how many were woken up by the napa earthquake httpAddress,Other Useful Information
17646,rt usrId england gbr grimsby httpAddress breaking news DD california earthquake california earthquake wine country clears,Other Useful Information
17647,oh my . i was afraid it would be up httpAddress rt usrId total economic losses estimated by usrId for napa earthquake at D billion httpAddress,Other Useful Information
17648,rt usrId interesting graph and data analysis by jawbone how the napa earthquake affected sleep httpAddress #weara,Other Useful Information
17649,rt usrId california usa fullerton httpAddress #earthquake breaking news DD earthquake 6.0 earthquake jolts bay area dama,Other Useful Information
17650,state of emergency after us quake a state of emergency has been declared in california after a strong quake httpAddress httpAddress,Other Useful Information
17652,#usaheadlines cleanup efforts underway after major earthquake in california httpAddress,Other Useful Information
17653,rt usrId this photo is very httpAddress #napa #earthquake httpAddress,Other Useful Information
17657,why the earthquake near san francisco is just the start of the shaking in california freedom outpost httpAddress,Other Useful Information
17659,usrId can you talk about the earthquake and the damage it brought san francisco on beyond tomorrow ? thanks in httpAddress beyond o !,Other Useful Information
17660,#earthquake #sismo m 2.2 0km sse of green valley california dyfi ? itime2014 08 28 14 05 22 httpAddress httpAddress,Other Useful Information
17662,followme gt ; #wascarx7 san francisco bay area assessing damage after large quake cbs httpAddress httpAddress followme gt ; #wascarx7,Other Useful Information
17664,usrId do all the california wine cellars httpAddress wine makers have earthquake insurance ? i wld figure that they do but i really don t know,Other Useful Information
17667,recent college grad evan kilkus helps #napaquake recovery httpAddress his drone to survey damage httpAddress httpAddress,Other Useful Information
17669,how the napa earthquake affected bay area sleepers thesouth napa earthquakewas the strongest to hit httpAddress httpAddress,Other Useful Information
17671,#earthquake of m 3.1 7km nw of the geysers california httpAddress,Other Useful Information
17672,jawbone looks at up data to see how many were woken up by the napa earthquake jawbone has shown one of the more interesting ways httpAddress,Other Useful Information
17673,netanyahu announces california earthquake payback for anti semites amp ; self haters preventing god s boat from docking in httpAddress,Other Useful Information
17674,rt usrId isis hijacks california earthquake hashtags to post threats on twitter httpAddress,Other Useful Information
17675,usrId video california shaken by earthquake,Other Useful Information
17676,california rocked awake during region s largest quake in DD years httpAddress,Other Useful Information
17678,watching news coverage of today s #earthquake amp ; damage up in httpAddress thankful to be safe ! #bayarea residents visit httpAddress,Other Useful Information
17683,biggest quakes by magnitude in california by the associated press california where a quake and fire httpAddress httpAddress,Other Useful Information
17686,rt usrId #earthquake early warning system works but is unfunded httpAddress #california,Other Useful Information
17691,usa california hit with earthquake of 6.0 magnitude ap an earthquake with a preliminary magnitude httpAddress httpAddress,Other Useful Information
17694,rt usrId california winemakers cleaning up after quake httpAddress via usrId,Other Useful Information
17697,cool data analysis of today s napa earthquake amp ; effect on sleep httpAddress by usrId data engineer usrId via usrId,Other Useful Information
17698,say what you want but the earthquake that hit california was all san andrea s httpAddress,Other Useful Information
17702,rt usrId usa httpAddress DD earthquake northern california rocked by magnitude 6.0 earthquake nicoleewayne washingto,Other Useful Information
17707,rt usrId this photo is very httpAddress #napa #earthquake httpAddress,Other Useful Information
17708,rt usrId california usa vallejo httpAddress breaking news DD earthquake earthquake in california napa shaken bay area st,Other Useful Information
17711,northern california braces for aftershocks after magnitude 6.0 earthquake fox news httpAddress,Other Useful Information
17717,disaster declared after chile quake chile declares three northern regions hit by a 8.2 magnitude earthquake httpAddress httpAddress,Other Useful Information
17718,rt usrId update tsunami waves of up to 2.4 feet measured or reported along coast of northern chile ; tsunami warnings httpAddress,Other Useful Information
17719,in the mean time here s our coverage of the chile earthquake aftermath by usrId with assist from usrId httpAddress,Other Useful Information
17720,rt usrId there was a 8.2 earthquake in chile yet the tabloids wanna focus on the fact that lindsay lohan s credit card declined whil,Other Useful Information
17722,massive chile earthquake may not be the big one httpAddress,Other Useful Information
17725,httpAddress earthquake strikes off the coast of httpAddress tsunami httpAddress httpAddress,Other Useful Information
17729,rt usrId 4.8 earthquake 96km wnw of iquique httpAddress apr D 0D 28 at epicenter D7m ago depth httpAddress httpAddress,Other Useful Information
17733,rt usrId powerful earthquake triggers tsunami off coast of chile httpAddress httpAddress,Other Useful Information
17736,httpAddress offshore tarapaca chile depth httpAddress apr 05 DD 00 33 57 utc apr 04 DD 20 33 57 at epicenter httpAddress,Other Useful Information
17739,rt usrId an earthquake 8 3 liberates 3x times more energy than the nagasaki s atomic httpAddress #prayforchile httpAddress,Other Useful Information
17746,227 s youtube chili microsoft227 227 s youtube chili chile earthquake 8.0 giant httpAddress httpAddress jamaal al din nba,Other Useful Information
17749,#albert stanlie inf chile earthquake no tsunami threat to california officials say a httpAddress httpAddress httpAddress,Other Useful Information
17752,rt usrId #rt i live in #chile httpAddress #asmsg #t4us #4ftm #aga3 #ian1 #bynr #chileearthquakeandtsunami #pdf1 ht,Other Useful Information
17753,#earthquake #sismo ml 3.4 offshore tarapaca chile magnitude ml httpAddress tarapaca chiledate httpAddress httpAddress,Other Useful Information
17755,rt usrId update earthquake in northern chile upgraded to magnitude 7.8 usgs httpAddress via usrId httpAddress,Other Useful Information
17758,rt usrId this incredible animation shows how chile s tsunami took over the entire pacific httpAddress watch httpAddress ht,Other Useful Information
17759,mt usrId situation report on the earthquake in httpAddress httpAddress #terremoto,Other Useful Information
17761,rt usrId strong earthquake near coast of tarapaca chile apr 7 13 D3 utc D #quake httpAddress httpAddress,Other Useful Information
17764,rt usrId breaking first #tsunami waves reach #chile coastline after massive aftershock navy httpAddress,Other Useful Information
17765,rt usrId we re live in DD minutes with the latest on the earthquake in #chile reports on #mh370 and details of the #middleeast peac,Other Useful Information
17767,rt usrId i just httpAddress i have friends in httpAddress tell me you re ok #earthquake,Other Useful Information
17771,rt usrId breaking pacific tsunami warning center puts preliminary magnitude of quake off northern chile at 7.4,Other Useful Information
17772,#earthquake m 3.9 south america chile antofagasta san pedro de atacama preliminary earthquake report .. httpAddress,Other Useful Information
17779,on a related note chile has weathered the earthquake very httpAddress they re very prepared down httpAddress and that was an httpAddress httpAddress,Other Useful Information
