392,que #temblorcr mas largo y httpAddress,Other Useful Information
393,dur como DD minutos #temblorcr,Other Useful Information
394,#temblorcr en rohrmoser se sinti muy fuerte y se quebraron httpAddress usrId,Other Useful Information
395,rt usrId #temblorcr se sinti muy muy fuerte ! #semesalioelcerote,Other Useful Information
396,siempre me agarra el #temblorcr cuando reviso twitter ! jajaja cosas de la vida,Other Useful Information
397,en #desamparados #temblorcr fuerte y httpAddress,Other Useful Information
398,rt usrId 7.9 earthquake off the coast of costa httpAddress sep D 8 42am at epicenter 6m ago 83km s of liberia depth httpAddress http ..,Other Useful Information
399,rt usrId httpAddress ne of samara costa rica	2012 09 05 14 42 10 #temblorcr,Other Useful Information
400,rt usrId 7.9 earthquake off the coast of costa httpAddress sep D 8 42am at epicenter 6m ago 83km s of liberia depth httpAddress http ..,Other Useful Information
401,rt usrId 7.9 earthquake off the coast of costa httpAddress sep D 8 42am at epicenter 6m ago 83km s of liberia depth httpAddress http ..,Other Useful Information
402,rt usrId more httpAddress earthquake rattles coastline of costa rica usgs says httpAddress,Other Useful Information
403,usrId 7.9 earthquake of the coast of costa httpAddress sep D 8 42am at epicenter 6m ago 83km s of liberia depth httpAddress httpAddress,Other Useful Information
404,rt usrId magnitude 7.9 earthquake strikes off the coast of costa rica usgs,Other Useful Information
405,preliminar 6.7 escala richter epicentro cangrejal d nicoya #temblorcr,Other Useful Information
406,magnitude 7.9 earthquake strikes off the coast of costa rica usgs,Other Useful Information
407,#temblorcr fuerte sismo tambin se sinti en territorio nicaraguense,Other Useful Information
408,httpAddress 7.9 earthquake off the coast of costa httpAddress sep D httpAddress,Other Useful Information
409,rt usrId magnitude 7.9 earthquake strikes off the coast of costa rica usgs,Other Useful Information
410,rt usrId magnitude 7.9 earthquake strikes off the coast of costa rica usgs,Other Useful Information
411,rt usrId 7.9 earthquake off the coast of costa httpAddress sep D 8 42am at epicenter 6m ago 83km s of liberia depth httpAddress http ..,Other Useful Information
412,rt usrId ahora terremoto de 7 9 en httpAddress ampliamos en httpAddress,Other Useful Information
413,rt usrId 7.9 magnitude earthquake strikes costa rica usgs via usrId #quake,Other Useful Information
414,rt usrId terremoto en costa rica amigos en el exterior la capital se encuentra sin daos importants de httpAddress sentido en todo e ..,Other Useful Information
415,usrId terremoto en costa rica de magnitud httpAddress,Other Useful Information
416,costa rican shaken by httpAddress earthquake httpAddress #costarica,Other Useful Information
417,rt usrId magnitude 7.9 earthquake strikes off the coast of costa rica usgs,Other Useful Information
418,rt usrId urgente un terremoto de magnitud 7 9 sacudi #costarica seg n el servicio geol gico de estados httpAddress httpAddress,Other Useful Information
419,rt usrId more httpAddress earthquake rattles coastline of costa rica usgs says httpAddress,Other Useful Information
420,movida de bote #temblorcr httpAddress,Other Useful Information
421,terremoto httpAddress en costa rica autoridades locales entregan detalles de httpAddress no se reportan mayores httpAddress,Other Useful Information
422,rt usrId ahora #costarica se cimbra con fuerte #sismo de 7.9,Other Useful Information
423,rt usrId magnitude 7.9 earthquake strikes off the coast of costa rica usgs,Other Useful Information
424,rt usrId urgente un terremoto de magnitud 7 9 sacudi #costarica seg n el servicio geol gico de estados httpAddress httpAddress,Other Useful Information
425,terremoto de magnitud 7 9 en costa rica,Other Useful Information
426,rt usrId strong earthquake hits costa rica httpAddress #costarica #quake,Other Useful Information
427,rt usrId httpAddress #earthquake hits off coast of costa httpAddress httpAddress,Other Useful Information
428,rt usrId terremoto en costa rica rt usrId seg n usgs el sismo habr a sido de 7 9 grados con epicentro en #guanacaste,Other Useful Information
429,7.9 magnitude earthquake hits costa rica #earthquake,Other Useful Information
430,rt usrId sismo de 7.9 fue a httpAddress millas de profundidad #costarica,Other Useful Information
431,rt usrId magnitude 7.9 earthquake strikes off the coast of costa rica usgs,Other Useful Information
432,uf ! terremoto en costa rica de 7 9 httpAddress DD km de profundidad,Other Useful Information
433,birth httpAddress 7.9 earthquake in costa rica,Other Useful Information
434,dice usrId httpAddress un terremoto de magnitud 7 9 sacudi #costarica seg n el servicio geol gico de estados unidos v a usrId,Other Useful Information
435,terremoto de magnitud 7 9 sacude costa rica httpAddress v a usrId,Other Useful Information
436,rt usrId un terremoto de magnitud 7.9 sacude costa rica,Other Useful Information
437,rt usrId 7.9 earthquake off the coast of costa httpAddress sep D 8 42am at epicenter 6m ago 83km s of liberia depth httpAddress http ..,Other Useful Information
438,rt usrId y yo creo q los mayas si la van a pegar !! #temblorcr,Other Useful Information
439,oh ! any damage report ? rt usrId 7.9 earthquake in costa httpAddress now,Other Useful Information
440,terremoto en costa rica puta madre 7.9,Other Useful Information
441,rt usrId urgente un terremoto de magnitud 7 9 sacudi #costarica seg n el servicio geol gico de estados httpAddress httpAddress,Other Useful Information
442,rt elmundoes un terremoto de magnitud 7.9 sacude costa rica,Other Useful Information
443,usrId ahora terremoto magnitud 7.9 en costa rica,Other Useful Information
444,rt usrId #ultimominuto autoridades de #costarica a n no reportan de v ctimas o daos por sismo de m 7.9,Other Useful Information
445,rt usrId magnitude 7.9 #earthquake hits #costarica httpAddress details soon httpAddress,Other Useful Information
446,rt usrId ltima hora un terremoto de magnitud 7.9 sacude costa rica,Other Useful Information
447,rt usrId ltima hora un terremoto de 7 9 de magnitud sacude el noroeste de costa rica httpAddress ms en httpAddress,Other Useful Information
448,7.9 earthquake off the coast of costa httpAddress sep D 8 42am at epicenter rt usrId,Other Useful Information
449,terremoto de magnitud 7 9 sacude costa rica httpAddress #cnn v a usrId,Other Useful Information
450,rt usrId 7.9 earthquake off the coast of costa httpAddress sep D 8 42am at epicenter 6m ago 83km s of liberia depth httpAddress http ..,Other Useful Information
451,rt usrId httpAddress #earthquake hits off coast of costa httpAddress httpAddress,Other Useful Information
452,rt usrId urgente un terremoto de magnitud 7 9 sacudi #costarica seg n el servicio geol gico de httpAddress,Other Useful Information
453,rt usrId revised httpAddress gt ; httpAddress 7.6 earthquake costa httpAddress sep D 8 D2am at epicenter 2Dm ago 60km sse of liberia depth D ..,Other Useful Information
454,terremoto de magnitud 7 9 sacude costa rica httpAddress,Other Useful Information
455,rt usrId muy fuerte terremoto de 7.9 en costa rica #sismoenvivo httpAddress,Other Useful Information
456,rt usrId magnitude 7.9 #earthquake hits #costarica httpAddress details soon httpAddress,Other Useful Information
457,rt usrId earthquake m httpAddress off the coast of costa rica httpAddress,Other Useful Information
458,rt usrId terremoto de 7 9 grados sacudi costa rica httpAddress seguiremos informando,Other Useful Information
459,rt usrId powerful httpAddress #earthquake reported in costa rica no immediate report of damage or injuries httpAddress mm,Other Useful Information
460,rt usrId # ltimominuto sismo de 7.9 grados sacudi #costarica seg n la usgs,Other Useful Information
461,mexico city a powerful httpAddress earthquake shakes costa httpAddress usgs said quake struck about DD miles from town of httpAddress,Other Useful Information
462,rt usrId revised httpAddress gt ; httpAddress 7.6 earthquake costa httpAddress sep D 8 D2am at epicenter 2Dm ago 60km sse of liberia depth D ..,Other Useful Information
463,rt usrId no hay alerta de tsunami para el httpAddress terremoto fue en el pacifico a 8km 5mi al ne de samara costa rica,Other Useful Information
464,rt usrId usgs corrigi magnitud de terremoto en costa rica a 7 6 richter httpAddress,Other Useful Information
465,rt usrId usgs revises costa rica earthquake to magnitude httpAddress details here httpAddress,Other Useful Information
466,rt usrId 7.9 earthquake off the coast of costa httpAddress sep D 8 42am at epicenter 6m ago 83km s of liberia depth httpAddress http ..,Other Useful Information
467,rt usrId powerful httpAddress #earthquake reported in costa rica no immediate report of damage or injuries httpAddress mm,Other Useful Information
468,piera tras terremoto en costa rica t pico si es de costa !!,Other Useful Information
469,rt usrId alerta usgs corrige magnitud del terremoto en costa rica a 7 6 grados al noreste de hojancha httpAddress,Other Useful Information
470,rt usrId si ests en la zona del sismo de magnitud 7 9 que sacudi #costarica y parte de #nicaragua comparte tus testimonios httpAddress ..,Other Useful Information
471,rt usrId rt usrId pais paralizado por el #temblorcr evacuaron completamente el segundo circuito judicial y cancelaron audie ..,Other Useful Information
472,rt usrId si ests en la zona del sismo de magnitud 7 9 que sacudi #costarica y parte de #nicaragua comparte tus testimonios httpAddress ..,Other Useful Information
473,rt usrId httpAddress #earthquake hits off coast of costa httpAddress httpAddress,Other Useful Information
474,rt usrId si ests en la zona del sismo de magnitud 7 9 que sacudi #costarica y parte de #nicaragua comparte tus testimonios httpAddress ..,Other Useful Information
475,powerful earthquake reported in costa rica httpAddress,Other Useful Information
476,earthquake report from costa httpAddress 7.6 quake no injuries httpAddress,Other Useful Information
477,terremoto en costa rica DD horas televisi n nacional de chile httpAddress usrId,Other Useful Information
478,rt usrId magnitude 7.9 earthquake hits off the coast of costa rica ; quake centered DD miles from san httpAddress usgs,Other Useful Information
479,rt usrId httpAddress #earthquake hits off coast of costa httpAddress httpAddress,Other Useful Information
480,rt usrId urgente un terremoto de magnitud 7 9 sacudi #costarica seg n el servicio geol gico de estados httpAddress httpAddress,Other Useful Information
481,rt usrId actualizaci n terremoto en costa rica fue de 7.6 grados en la escala de richter #t13alahora,Other Useful Information
482,terremoto de magnitud 7 6 sacude costa rica httpAddress #cnn v a usrId,Other Useful Information
483,rt usrId si ests en la zona del sismo de magnitud 7 9 que sacudi #costarica y parte de #nicaragua comparte tus testimonios httpAddress ..,Other Useful Information
484,rt usrId magnitude 7.9 earthquake strikes off the coast of costa rica usgs,Other Useful Information
485,rt usrId si ests en la zona del sismo de magnitud 7 9 que sacudi #costarica y parte de #nicaragua comparte tus testimonios httpAddress ..,Other Useful Information
486,rt usrId revised httpAddress gt ; httpAddress 7.6 earthquake costa httpAddress sep D 8 D2am at epicenter 2Dm ago 60km sse of liberia depth D ..,Other Useful Information
487,usrId rt usrId breaking magnitude 7.9 earthquake strikes off the coast of costa rica tsunami watch .. httpAddress,Other Useful Information
488,usrId que ! hubo un terremoto 7.6 en costa rica !?? httpAddress httpAddress csm,Other Useful Information
489,rt usrId usgs magnitude of quake off costa rica reduced from 7.9 to httpAddress httpAddress,Other Useful Information
490,rt usrId fuertes rplicas se sienten ahora en #costarica tras #sismo de magnitud 7 6 que sacudi el pa s httpAddress,Other Useful Information
491,terremoto de magnitude 7 9 atinge costa rica um terremoto de magnitude 7 9 na escala richter foi registrado na .. httpAddress,Other Useful Information
492,costa rica earthquake 2012 7.9 magnitude quake hits costa rica httpAddress #jcagain,Other Useful Information
493,costa rica earthquake 2012 7.9 magnitude quake hits costa rica httpAddress,Other Useful Information
494,rt usrId fuertes rplicas se sienten ahora en #costarica tras #sismo de magnitud 7 6 que sacudi el pa s httpAddress,Other Useful Information
495,no se reportan daos de importancia tras fuerte sismo en #costarica el cual se confirma fue de 7.6 grados !,Other Useful Information
496,rt usrId usgs magnitude of quake off costa rica reduced from 7.9 to httpAddress httpAddress,Other Useful Information
497,rt usrId 7.9 earthquake off the coast of costa httpAddress sep D 8 42am at epicenter 6m ago 83km s of liberia depth httpAddress http ..,Other Useful Information
498,httpAddress quake hits on costa rican coast httpAddress #cnn,Other Useful Information
499,usrId fuertes rplicas se sienten ahora en #costarica tras #sismo de magnitud 7 6 que sacudi el pa s httpAddress,Other Useful Information
500,#elsalvador . #guatemala #costarica ; #nicaragua #panama nose sabe la localizacion de la gran magnitud,Other Useful Information
501,cuaatico terremoto en costa rica . .,Other Useful Information
502,rt usrId cne cancela alerta de tsunami para costa rica #temblorcr,Other Useful Information
503,forte terremoto de magnitude 7 9 atinge a costa rica httpAddress,Other Useful Information
504,rt usrId terremoto de 7 9 sacude costa rica,Other Useful Information
505,rt usrId shoa entreg horarios estimados de arribo a chile de oleaje por terremoto en costa rica httpAddress,Other Useful Information
506,rt usrId 7.9 earthquake hits costa rica,Other Useful Information
507,rt usrId powerful earthquake hits costa rica httpAddress,Other Useful Information
508,rt usrId fuertes rplicas se sienten ahora en #costarica tras #sismo de magnitud 7 6 que sacudi el pa s httpAddress,Other Useful Information
509,terremoto de magnitud 7 6 sacude costa rica httpAddress,Other Useful Information
510,strong earthquake hits costa rica httpAddress,Other Useful Information
511,rt usrId si ests en la zona del sismo de magnitud 7 9 que sacudi #costarica y parte de #nicaragua comparte tus testimonios httpAddress ..,Other Useful Information
512,rt usrId urgente un terremoto de magnitud 7 9 sacudi #costarica seg n el servicio geol gico de estados httpAddress httpAddress,Other Useful Information
513,rt usrId fuertes rplicas se sienten ahora en #costarica tras #sismo de magnitud 7 6 que sacudi el pa s httpAddress,Other Useful Information
514,rt usrId 7.9 earthquake hits costa rica httpAddress,Other Useful Information
515,httpAddress magnitude 7.9 quake strikes northwestern costa rica washington reuters a 7.9 httpAddress httpAddress travel,Other Useful Information
516,7.9 quake off pacific coast of costa rica usgs httpAddress #international,Other Useful Information
517,8.0 earthquake in costa rica hope my grandparents are okay,Other Useful Information
518,rt usrId fuertes rplicas se sienten ahora en #costarica tras #sismo de magnitud 7 6 que sacudi el pa s httpAddress,Other Useful Information
519,fuertes rplicas se sienten ahora en #costarica tras #sismo de magnitud 7 6 que sacudi el httpAddress,Other Useful Information
520,fuertes rplicas se sienten ahora en #costarica tras #sismo de magnitud 7 6 que sacudi el httpAddress,Other Useful Information
521,httpAddress quake hits off costa rica an earthquake with a preliminary magnitude of 7.9 struck off the coast .. httpAddress,Other Useful Information
522,rt usrId 7.9 earthquake off the coast of costa httpAddress sep D 8 42am at epicenter 6m ago 83km s of liberia depth httpAddress http ..,Other Useful Information
523,rt usrId terremoto en costa rica de D grados en la escala de httpAddress toda la informaci n por atv,Other Useful Information
524,rt usrId glendacnn estamos en vivo con fuerte sismo en #costarica httpAddress tu tierra mi cont http httpAddresst.co mo8uhkcz,Other Useful Information
525,revisa la hora en que llegar an a la costa chilena las olas causadas por el terremoto en #costarica httpAddress,Other Useful Information
526,yo giniralmente no me asusto pero hoy s ! #temblorcr,Other Useful Information
527,rt usrId rt usrId terremoto de 7 6 sacude #costarica telenoticias httpAddress,Other Useful Information
528,terremoto en costa rica de 7 6,Other Useful Information
529,httpAddress earthquake shakes costa rica httpAddress,Other Useful Information
530,rt usrId revistan la magnitud del #terremoto en #costarica a 7 6 grados usgs,Other Useful Information
531,rt usrId univisionnews breaking magnitude 7.9 earthquake strikes northwestern costa rica usrId,Other Useful Information
532,rt usrId terremoto en costa rica desactivan alerta de tsunami,Other Useful Information
533,#terremotocr todavia hay replicas y gente asustada ! d,Other Useful Information
534,rt usrId revistan la magnitud del #terremoto en #costarica a 7 6 grados usgs,Other Useful Information
535,powerful earthquake reported in costa rica abc news httpAddress via usrId,Other Useful Information
536,rt usrId fuertes rplicas se sienten ahora en #costarica tras #sismo de magnitud 7 6 que sacudi el pa s httpAddress,Other Useful Information
537,rt usrId 7.9 quake off pacific coast of costa rica usgs httpAddress,Other Useful Information
538,mapa y datos de terremoto en costa rica magnitud 7.6 10km ne de hojancha guanacaste httpAddress rr,Other Useful Information
539,costa rica earthquake hits at 7.9 magnitude httpAddress,Other Useful Information
540,rt usrId alcald a del puerto de la libertad hace monitoreo por posible alto oleaje despus de terremoto en costa rica #costarica #s ..,Other Useful Information
541,rt usrId terremoto de 7.6 en costa rica httpAddress cobertura completa siguenos usrId #santinoticias,Other Useful Information
542,washingtonpost powerful quake hits #costarica httpAddress #sismocr #temblocr,Other Useful Information
543,rt usrId #breakingnews httpAddress #earthquake hits costa rica about DD miles from town of liberia ; no immediate report of damage or injuries,Other Useful Information
544,rt usrId actualizado terremoto 7 6 richter se registra en costa rica httpAddress,Other Useful Information
545,usrId you missed our earthquake 7.6 in costa rica,Other Useful Information
546,rt usrId httpAddress quake hits on costa rican httpAddress httpAddress,Other Useful Information
547,rt usrId httpAddress quake hits on costa rican httpAddress httpAddress,Other Useful Information
548,rt usrId reports that quake has triggered landslides inland in costa rica,Other Useful Information
549,terremoto en costa rica !! aahh ya no quiero ir !!,Other Useful Information
550,earthquake here in #costarica #temblorcr,Other Useful Information
551,rt usrId #envivo reporta el miembro de los bomberos de #costarica se ha activado operativo de emergencia con todas las autoridade ..,Other Useful Information
552,rt usrId first pictures surfacing of costa rica httpAddress usrId temblor carretera san carlos zarcero #temblorcr httpAddress ..,Other Useful Information
553,usrId un terremoto de 7 9 sacude costa rica httpAddress cerca de la costa del pac fico a una profundidad de DD kil metros,Other Useful Information
554,me cay un tele httpAddress #temblorcr jajajaja #mentira,Other Useful Information
555,rt usrId red cross in costa rica says no casualties reported so far after quake usrId,Other Useful Information
556,rt usrId a las 8 47 hubo un terremoto de 7.9 en costa rica y las rplicas amenazan httpAddress,Other Useful Information
557,rt usrId el epicentro del terremoto en costa rica fue en tierra por eso no se gener un httpAddress,Other Useful Information
558,powerful earthquake reported in costa rica nosara costa rica ap a powerful httpAddress httpAddress via ap newsfeed,Other Useful Information
559,usrId terremoto en costa rica !! 6.9 creo !,Other Useful Information
560,powerful earthquake reported in costa rica nosara costa rica ap a powerful httpAddress httpAddress via ap politics,Other Useful Information
561,usrId san jose costa rica temblor considerable se sintio en mi #chiriqui segun reportes !!,Other Useful Information
562,rt usrId reiteramos la dhn de la marina del per descart tsunami en nuestras costas por el terremoto en costa rica httpAddress ..,Other Useful Information
563,rt usrId rt usrId red cross in costa rica says no casualties reported so far after quake usrId ll usrId,Other Useful Information
564,rt usrId video del fuerte terremoto en costa rica #sismoenvivo httpAddress,Other Useful Information
565,terremoto muy fuerte cerca de costa rica,Other Useful Information
566,powerful earthquake reported in costa rica abc news httpAddress via usrId,Other Useful Information
567,httpAddress terremoto en costa rica httpAddress,Other Useful Information
568,un terremoto de intensidad 7 9 sacude costa httpAddress httpAddress,Other Useful Information
569,rt usrId fue #temblocr o #terremotocr ?,Other Useful Information
570,d terremoto en costa rica,Other Useful Information
571,#worldnews #news quake rocks costa rican coast some damage has been reported after a strong earthquake struck httpAddress httpAddress,Other Useful Information
572,rt usrId video terremoto de 7.6 grados en la escala richter registrado en #costarica a las 8 42 am seg n httpAddress httpAddress ..,Other Useful Information
573,httpAddress strong earthquake hits costa rica a powerful earthquake of 7.6 magnitude rocks north west httpAddress httpAddress,Other Useful Information
574,httpAddress quake strikes off costa rica coast httpAddress #breakingnews #costarica,Other Useful Information
575,rt usrId terremoto de 7 9 grados sacudi costa rica httpAddress seguiremos informando,Other Useful Information
576,usrId reporting that there has been damage reported to the estadio nacional in costa rica following httpAddress,Other Useful Information
577,calma ! calma ! que no panda el cunico sirvi para que nos espabilaramos el pa s se esta callendo en pedazos #terremotocr #temblorcr,Other Useful Information
578,rt usrId costa rica official there s chaos in san jose because it was a strong earthquake of long duration httpAddress mm,Other Useful Information
579,terremoto en costa rica,Other Useful Information
580,httpAddress quake strikes off costa rica coast httpAddress,Other Useful Information
581,there was a earthquake magnitude of 7.6 that hit costa rica this morning only D hours from our honeymoon spot !,Other Useful Information
582,httpAddress quake hits off costa rica httpAddress usrId #news,Other Useful Information
583,rt usrId playa pilas guanacaste #temblorcr httpAddress,Other Useful Information
584,rt usrId rt usrId httpAddress video del momento del temblor en costa rica httpAddress gracias por compartir el v deo !,Other Useful Information
585,canal de costa rica transmite en directo primeras imgenes del httpAddress mira aqu httpAddress,Other Useful Information
586,usa today magnitude 7.6 quake strikes costa rica a powerful httpAddress earthquake struck in costa rica httpAddress httpAddress,Other Useful Information
587,costa rica struck by 7.9 mag quake about DD miles from town of liberia centered about DD miles below the httpAddress no fatalities httpAddress,Other Useful Information
588,rt usrId urgente un terremoto de magnitud 7 9 sacudi #costarica seg n el servicio geol gico de estados httpAddress httpAddress,Other Useful Information
589,rt usrId terremoto 7 6 ricther sacude costa rica mxima percepci n mercalli vii cancelada alerta de tsunami para chile htt ..,Other Useful Information
590,rt usrId costa rica httpAddress earthquake largest quake to hit the country since DD httpAddress,Other Useful Information
591,rt usrId httpAddress #earthquake hits off coast of costa httpAddress httpAddress,Other Useful Information
592,powerful httpAddress earthquake reported in costa rica httpAddress,Other Useful Information
593,#earthquake httpAddress costa rica httpAddress,Other Useful Information
594,rt usrId #costarica se reportan al menos DD replicas tras el terremoto de 7 6 grados de las 8 42am de este d a httpAddress # ..,Other Useful Information
595,rt usrId #costarica se reportan al menos DD replicas tras el terremoto de 7 6 grados de las 8 42am de este d a httpAddress # ..,Other Useful Information
596,video nicaragua evacu a las comunidades del pac fico por el terremoto en costa rica #tsunami httpAddress,Other Useful Information
597,rt usrId #terremotocr 7.6 scale #earthquake en #liberia #guanacaste #costarica muy fuerte !!,Other Useful Information
598,rt usrId ya sali marcelo lagos hablando del terremoto en costa rica ?,Other Useful Information
599,rt usrId normalidad en las actividades del aeropuerto internacional juan httpAddress #terremotocr,Other Useful Information
600,rt usrId first video 7.6 magnitude quake strikes off the coast of costa rica httpAddress,Other Useful Information
601,reportan al menos DD replicas tras el #terremoto de 7 6 grados de las 8 42 am de hoy en httpAddress,Other Useful Information
602,usrId terremoto en costa rica,Other Useful Information
603,rt usrId 7.9 earthquake off the coast of costa httpAddress sep D 8 42am at epicenter 6m ago 83km s of liberia depth httpAddress http ..,Other Useful Information
604,rt usrId costa rica httpAddress earthquake largest quake to hit the country since DD httpAddress,Other Useful Information
605,corrigieron la magnitud del terremoto en #costarica a 6.7 grados y descartaron la alerta sobre el posible #tsunami,Other Useful Information
606,httpAddress #earthquake hits #costarican coast httpAddress #cnn,Other Useful Information
607,rt usrId magnitude 7.9 earthquake strikes off the coast of costa rica usgs,Other Useful Information
