45,rt usrId caribbean wide tsunami watch in effect after costa rican quake pacific tsunami warning center,Caution and advice
46,rt usrId live coverage httpAddress earthquake rattles the coast of costa rica ; tsunami watch for caribbean in effect httpAddress ..,Caution and advice
47,rt usrId caribbean wide tsunami watch in effect after costa rican quake pacific tsunami warning center says usrId,Caution and advice
48,rt usrId urgente terremoto en costa rica de httpAddress aviso de tsunami costa rica panama nicaragua el salvador honduras mexico ..,Caution and advice
49,rt usrId caribbean wide tsunami watch in effect after costa rican quake pacific tsunami warning center says usrId,Caution and advice
50,rt usrId caribbean wide tsunami watch in effect after costa rican quake pacific tsunami warning center says usrId #lgf #p2,Caution and advice
51,rt usrId live coverage httpAddress earthquake rattles the coast of costa rica ; tsunami watch for caribbean in effect httpAddress ..,Caution and advice
52,rt usrId urgente un terremoto de magnitud 7 9 sacudi #costarica seg n el servicio geol gico de estados httpAddress httpAddress,Caution and advice
53,rt usrId caribbean wide tsunami watch in effect after costa rican quake pacific tsunami warning center says usrId,Caution and advice
54,rt usrId breaking 7.9 magnitude earthquake strikes off the coast of costa rica caribbean wide tsunami watch in effect details t ..,Caution and advice
55,rt usrId live coverage httpAddress earthquake rattles the coast of costa rica ; tsunami watch for caribbean in effect httpAddress ..,Caution and advice
56,#temblor usrId #tsunami warning pacific tsunami warning in effect for costa httpAddress httpAddress,Caution and advice
57,la alerta de tsunami a causa del terremoto en costa rica llega hasta ecuador nos salvamos ? . .,Caution and advice
58,rt usrId caribbean wide tsunami watch in effect after costa rican quake pacific tsunami warning center says usrId,Caution and advice
59,alerta de tsunami en todo la costa de costa rica terremoto 7.9,Caution and advice
60,rt usrId caribbean wide tsunami watch in effect after costa rican quake pacific tsunami warning center says usrId,Caution and advice
61,rt usrId caribbean wide tsunami watch in effect after costa rican quake pacific tsunami warning center says usrId,Caution and advice
62,rt usrId httpAddress #earthquake hits off coast of costa httpAddress httpAddress,Caution and advice
63,rt usrId en desarrollo terremoto 7 9 grados se registr en costa httpAddress activan alerta de tsunami para centro amrica y sudam ..,Caution and advice
64,usrId seg n usgs sismo de 7.9 se sinti hace unos minutos 8 42 am en #costarica con epicentro en httpAddress,Caution and advice
65,usrId breaking 7.9 #earthquake off costa rica httpAddress #tsunmai warning for west coasts of central httpAddress,Caution and advice
66,rt usrId shoa publica alerta de tsunami para las costas de chile tras terremoto en costa httpAddress httpAddress,Caution and advice
67,rt usrId urgente terremoto en costa rica de httpAddress aviso de tsunami costa rica panama nicaragua el salvador honduras mexico ..,Caution and advice
68,rt usrId tras el sismo de 7 9 en #costarica hay alerta de #tsunami para toda la zona costera desde #centroamrica hasta #brasil http ..,Caution and advice
69,rt usrId tras el sismo de 7 9 en #costarica hay alerta de #tsunami para toda la zona costera desde #centroamrica hasta #brasil http ..,Caution and advice
70,rt usrId sismo 7.9 en httpAddress se activa alerta de httpAddress,Caution and advice
71,rt usrId caribbean wide tsunami watch in effect after costa rican quake pacific tsunami warning center says usrId,Caution and advice
72,alerta httpAddress decretan alerta de tsunami luego de terremoto de magnitud 7.9 grados que azot costa rica,Caution and advice
73,rt usrId tras el sismo de 7 9 en #costarica hay alerta de #tsunami para toda la zona costera desde #centroamrica hasta #brasil http ..,Caution and advice
74,rt usrId httpAddress alerta de #tsunami en el pac fico tras #temblor con epicentro en costa httpAddress httpAddress,Caution and advice
75,rt usrId shoa anuncia en su pgina web de alerta de tsunami para las costas chilenas tras terremoto en costa rica httpAddress ..,Caution and advice
76,a caribbean wide tsunami watch is in effect after a httpAddress earthquake struck costa httpAddress #keepsafe #godbless,Caution and advice
77,rt usrId tras el sismo de 7 9 en #costarica hay alerta de #tsunami para toda la zona costera desde #centroamrica hasta #brasil http ..,Caution and advice
78,rt usrId chile s navy says declares tsunami alert warning for chilean coast following costa rica quake,Caution and advice
79,usrId tras el sismo de 7 9 en #costarica hay alerta de #tsunami para toda la zona costera desde #centroamrica hasta #brasil #colombia,Caution and advice
80,rt usrId urgente #terremoto en #costarica origin breve alerta de tsunami que ya fue cancelada para chile,Caution and advice
81,rt usrId tras el sismo de 7 9 en #costarica hay alerta de #tsunami para toda la zona costera desde #centroamrica hasta #brasil http ..,Caution and advice
82,rt usrId tras el sismo de 7 9 en #costarica hay alerta de #tsunami para toda la zona costera desde #centroamrica hasta #brasil http ..,Caution and advice
83,rt usrId breaking coast of costa rica hit by a 7.9 magnitude httpAddress tsunami warning in httpAddress no word of any httpAddress,Caution and advice
84,rt usrId alerta de tsunami para las costas chilenas por el terremoto en costa rica !,Caution and advice
85,rt usrId ahora shoa decreta alerta de tsunami para la costa chilena tras terremoto en costa httpAddress,Caution and advice
86,rt usrId ahora shoa publica en este momento que hay alerta de tsunami para #chile por terremoto en #costarica httpAddress,Caution and advice
87,rt usrId tras el sismo de 7 9 en #costarica hay alerta de #tsunami para toda la zona costera desde #centroamrica hasta #brasil http ..,Caution and advice
88,tras el sismo de 7 9 en #costarica hay alerta de #tsunami para toda la zona costera desde #centroamrica hasta #brasil,Caution and advice
89,rt usrId httpAddress 7.9 #earthquake just off the coast of costa httpAddress #tsunami warnings for pacific coast of mexico c . amehttpAddress s . a ..,Caution and advice
90,ltima hora un terremoto de 7 9 de magnitud sacude el noroeste de costa rica,Caution and advice
91,rt usrId caribbean wide tsunami watch in effect after costa rican quake pacific tsunami warning center says usrId,Caution and advice
92,rt usrId urgente fuerte terremoto en costa httpAddress alerta de tsunami para costa rica barbados mxico brasil guyana francesa y caribe,Caution and advice
93,rt usrId tras el sismo de 7 9 en #costarica hay alerta de #tsunami para toda la zona costera desde #centroamrica hasta #brasil http ..,Caution and advice
94,rt breakingnews magnitude 7.9 earthquake strikes off the coast of costa rica usgs,Caution and advice
95,rt usrId alerta de tsunami para las costas de chile por terremoto en costa httpAddress shoa,Caution and advice
96,rt usrId urgente un terremoto de magnitud 7 9 sacudi #costarica seg n el servicio geol gico de estados httpAddress httpAddress,Caution and advice
97,rt usrId breaking magnitude 7.9 earthquake strikes off the coast of costa rica tsunami watch for caribbean reuters reports,Caution and advice
98,rt usrId ahora shoa publica en este momento que hay alerta de tsunami para #chile por terremoto en #costarica httpAddress,Caution and advice
99,aviso de tsunami en el caribe tras un terremoto de 7.9 cerca de costa rica,Caution and advice
100,rt usrId urgente snam declara alerta de tsunami para costas de chile por terremoto en 7.9 richter en costa rica usrId,Caution and advice
101,rt usrId tras el sismo de 7 9 en #costarica hay alerta de #tsunami para toda la zona costera desde #centroamrica hasta #brasil http ..,Caution and advice
102,rt usrId por la prueba en #costarica no se descarta posibilidad de tsunami desde #centroamrica hasta httpAddress atentos httpAddress,Caution and advice
103,rt usrId ltima hora terremoto de 7.9 grados en costa httpAddress hay alerta de tsunami,Caution and advice
104,terremoto de 7 9 grados richter azota costa rica y el shoa transmite alerta de tsunami preventiva para costas chilenas httpAddress,Caution and advice
105,rt usrId por la prueba en #costarica no se descarta posibilidad de tsunami desde #centroamrica hasta httpAddress de hacer httpAddress,Caution and advice
106,rt usrId #terremoto en costa rica activa alerta de #tsunami para norte de chile aqu la noticia completa httpAddress,Caution and advice
107,bolet n n 1 noaa ptwc para el mar caribe 5 sep 2012 wide tsunami watch in effect #sismo #earthquake httpAddress,Caution and advice
108,rt usrId ltima hora terremoto de 7.9 grados en costa httpAddress hay alerta de tsunami,Caution and advice
109,rt usrId alerta de tsunami para las costas de chile por terremoto en costa httpAddress shoa,Caution and advice
110,o rt usrId gt ; rt usrId terremoto de 7.9 en costa rica una advertencia de tsunami cont httpAddress,Caution and advice
111,rt usrId tras el sismo de 7 9 en #costarica hay alerta de #tsunami para toda la zona costera desde #centroamrica hasta #brasil http ..,Caution and advice
112,rt usrId #ultimominuto autoridades han emitido alerta de tsunami para la zona del caribe por sismo de httpAddress en #costarica,Caution and advice
113,httpAddress httpAddress hr chilena terremoto en costa rica httpAddress se descart tsumani para centroamerica,Caution and advice
114,rt usrId urgente ante terremoto en costa rica shoa advierte probabilidad de tsunami en chile httpAddress favor aten ..,Caution and advice
115,rt usrId chile s navy declares tsunami alert warning for country s coastline following costa rica quake usrId usgs revise ..,Caution and advice
116,rt usrId #ultimominuto terremoto de 7 6 sacude costa rica y declaran a la vez alerta de tsunami en chile,Caution and advice
117,rt usrId tras el sismo de 7 9 en #costarica hay alerta de #tsunami para toda la zona costera desde #centroamrica hasta #brasil http ..,Caution and advice
118,rt usrId ahora cancelan alerta de tsunami para costas del pac fico luego de terremoto httpAddress richter en costa rica httpAddress ..,Caution and advice
119,rt usrId chile s navy declares tsunami alert warning for country s coastline following costa rica quake usrId usgs revise ..,Caution and advice
120,hubo un terremoto en costa rica de 7.9 grados y hay alerta de tsunami para ecuador y no hay nada en twitter al respecto ?,Caution and advice
121,rt usrId terremoto de 7 9 grados richter azota costa rica y shoa transmite alerta de tsunami preventiva para costas chilenas http ..,Caution and advice
122,rt usrId terremoto de 7.6 grados en costa rica con alerta de tsunami en las costas de mxico panam colombia y httpAddress,Caution and advice
123,rt usrId usgs corrige magnitud del terremoto en costa rica a httpAddress hay alerta de tsunami en las costas de httpAddress #cnnchile,Caution and advice
124,terremoto 7.9 en costa rica nuevamente alerta d tsunami en panama y otros httpAddress,Caution and advice
125,rt usrId just in usgs reports 7.9 magnitude earthquake off the coast of costa httpAddress tsunami watch issued for the httpAddress,Caution and advice
126,rt usrId tras el sismo de 7 9 en #costarica hay alerta de #tsunami para toda la zona costera desde #centroamrica hasta #brasil http ..,Caution and advice
127,rt usrId avance alerta de tsunami para per y pa ses del pac fico por terremoto en costa rica,Caution and advice
128,rt usrId #terremoto en costa rica activa alerta de #tsunami para norte de chile aqu la noticia completa httpAddress,Caution and advice
129,rt usrId chile s navy declares tsunami alert warning for country s coastline following costa rica quake usrId usgs revise ..,Caution and advice
130,rt usrId hace instantes fuerte #terremoto 7.6 costa del pacifico costa httpAddress #chile en vigilancia de #tsunami,Caution and advice
131,alerta de tsunami para chile por terremoto en costa rica de 7.9 atento costeros,Caution and advice
132,rt usrId chile s navy declares tsunami alert warning for country s coastline following costa rica quake usrId usgs revise ..,Caution and advice
133,rt usrId #terremoto en costa rica activa alerta de #tsunami para norte de chile aqu la noticia completa httpAddress,Caution and advice
134,rt usrId atentos !! snam declara alerta de tsunami para costas de chile por terremoto en costa rica httpAddress rt,Caution and advice
135,usrId #ultimominuto autoridades han emitido alerta de tsunami para la zona del caribe por sismo de httpAddress en #costarica,Caution and advice
136,atencion quinteranos alerta de posible tsunami por terremoto en costa rica grado httpAddress marejadas estarian httpAddress httpAddress,Caution and advice
137,rt usrId terremoto de 7.6 en costa rica personas reportan que el sismo fue bastante intenso y httpAddress #santinoticias,Caution and advice
138,usrId alerta de tsumani para el norte de chile debido a terremoto grado 7 6 richter en costa httpAddress llegar an apartir d las 17hrs,Caution and advice
139,rt usrId el shoa eman una alerta de tsunami en chile por el sismo en #costarica httpAddress,Caution and advice
140,rt usrId breaking 7.9 magnitude earthquake strikes off the coast of costa rica caribbean wide tsunami watch in effect details t ..,Caution and advice
141,rt usrId ltima hora alerta de tsunami en amrica central y chile tras fuerte terremoto en costa rica,Caution and advice
142,rt usrId alerta de #tsunami en costa del pac fico por sismo de 7.9 en #costarica reporta el servicio geol gico de estados unidos,Caution and advice
143,rt usrId rt usrId update costa rica earthquake revised to magnitude httpAddress caribbean wide tsunami watch cancelled httpAddress ..,Caution and advice
144,informaci n de la onemi de hora de arribo de olas a las costas chilenas por efecto de terremoto en costa rica httpAddress,Caution and advice
145,rt usrId shoa publica horas estimadas para arribo a las costas chilenas de tsunami por terremoto 7 6 richter en costa rica httpAddress ..,Caution and advice
146,rt usrId usrId tras el sismo d7 9 en #costarica hay alertad #tsunami para toda la zona costeradesd #centroamrica hasta #brasil h ..,Caution and advice
147,rt usrId shoa entreg horarios estimados de arribo a chile de oleaje por terremoto en costa rica httpAddress,Caution and advice
148,usrId reducen a 7 6 la magnitud del sismo que sacudi #costarica y que activ una alerta de tsunami httpAddress,Caution and advice
149,informaci n ampliada alerta de tsunami para las costas de chile por terremoto en costa rica httpAddress,Caution and advice
150,usrId big httpAddress occurred in costa httpAddress please be careful for tsunami people lives around the caribbean httpAddress,Caution and advice
151,rt usrId terremoto en costa rica 7.9 alerta de httpAddress esperando detalles,Caution and advice
152,rt usrId shoa emiti alerta de tsunami para costa chilena tras terremoto en costa rica httpAddress,Caution and advice
153,me cagaron con la geografia terremoto en costa rica alerta de tsunami en chile ?,Caution and advice
154,rt usrId earthquake of 7.6 hits costa httpAddress tsunami warning,Caution and advice
155,rt usrId si no es necesario no usen el telfono es importante no saturar httpAddress #temblorcr,Caution and advice
156,rt usrId la advertencia de tsunami por el terremoto en costa rica fue para mxico colombia ecuador per chile entre otros,Caution and advice
157,usrId usrId se mantiene alerta de tsunami en zona costera y hacia afuera del pac fico httpAddress #terremotocr #sismocr,Caution and advice
158,rt usrId reducen a 7 6 la magnitud del sismo que sacudi #costarica y que activ una alerta de tsunami httpAddress,Caution and advice
159,pacific tsunami warning issued after magnitude 7.9 earthquake strikes costa httpAddress,Caution and advice
160,rt usrId terremoto de 7 9 mar adentro en costa httpAddress se activa la alerta por tsunami en la costa del pac fico de amrica httpAddress ..,Caution and advice
161,rt usrId httpAddress fuerte sismo sacude httpAddress hay alerta de tsunami para centroamrica httpAddress httpAddress ..,Caution and advice
162,rt usrId caribbean wide tsunami watch in effect after costa rican quake pacific tsunami warning center,Caution and advice
163,rt usrId terremoto de 7 9 grados en costa httpAddress alerta de tsunami para la costa del pac fico nicaragua mxico per colombia c ..,Caution and advice
164,rt usrId advertencia de tsunami en #costarica panam nicaragua el salvador honduras mxico colombia ecuador guatemala ecuador y per,Caution and advice
165,earthquake of 7.6 hits costa httpAddress tsunami warning !,Caution and advice
166,esta activada la herradura del pac fico y el circulo de fuego salvese quien httpAddress #costarica,Caution and advice
167,tsunami alert as 7.6 quake strikes off costa rica a tsunami alert is issued for central america after a httpAddress httpAddress,Caution and advice
168,for my friends in httpAddress just in httpAddress 7.9 httpAddress quake off of costa rica prompted httpAddress httpAddress,Caution and advice
169,terremoto de 7 9 grados sacude costa rica alerta de tsunami terra chile httpAddress v a usrId,Caution and advice
170,tsunami alert as 7.6 quake strikes off costa rica a tsunami alert is issued for central america after a httpAddress httpAddress,Caution and advice
171,centro advertencia tsunamis pac fico retira alerta tsunami para caribe tras #sismo #costarica mantiene advertencia regi n costa pacifico,Caution and advice
172,rt usrId aviso de tsunami en el caribe tras un terremoto de 7 9 cerca de costa rica httpAddress,Caution and advice
173,rt usrId informamos que hubo un terremoto 7.9 richter en costa rica y se establece alerta de tsunami para las costas de httpAddress ..,Caution and advice
174,rt usrId ltimo terremoto de 7.9 grados richter en costa httpAddress emitida alerta de tsunami,Caution and advice
175,rt usrId usrId pacific tsunami warning center keeps warning for pacific coastal region following costa rica earthquake htt ..,Caution and advice
176,tsunami alert as 7.6 quake strikes off costa rica httpAddress,Caution and advice
177,rt usrId shoa emiti alerta de tsunami para costa chilena tras terremoto en costa rica httpAddress,Caution and advice
178,usrId emiten alerta de tsunami en chile tras terremoto en costa rica httpAddress httpAddress cc usrId salu2 hermosa,Caution and advice
179,cnn news tsunami alert as 7.6 quake strikes off costa rica a tsunami alert is issued for central america after .. httpAddress,Caution and advice
180,rt usrId tras el sismo de 7 9 en #costarica hay alerta de #tsunami para toda la zona costera desde #centroamrica hasta #brasil http ..,Caution and advice
181,rt usrId #panama un temblor de 7.9 se registro en costa httpAddress alerta de tsunami para el httpAddress usrId usrId,Caution and advice
182,el terremoto de 7.6 fue ser de liberia costa rica en la costa del pacifico,Caution and advice
183,rt usrId magnitude 7.6 quake hits costa httpAddress latest details including active tsunami warnings httpAddress,Caution and advice
184,rt usrId terremoto de 7.9 grados en costa httpAddress hay alerta de tsunami httpAddress,Caution and advice
185,brother hubo temblor en costa rica y por lo que he leido hay probabilidad de tsunami y uno de los paises q serian afectado es ecuador s,Caution and advice
186,rt usrId existe advertencia de tsunami para amrcia central por terremoto ocurrido en costa rica a las 8 42 hora httpAddress,Caution and advice
187,strong earthquake hits costa rica a powerful earthquake of 7.9 magnitude rocks north west costa rica httpAddress httpAddress,Caution and advice
188,rt usrId actualizado terremoto de 7 6 sacudi a costa httpAddress onemi mantiene la alerta de tsunami para las costas de httpAddress httpAddress ..,Caution and advice
189,rt usrId tras el sismo de 7 9 en #costarica hay alerta de #tsunami para toda la zona costera desde #centroamrica hasta #brasil http ..,Caution and advice
190,strong 7.9 quake hits costa rica tsunami warning issued yahoo ! news httpAddress via usrId,Caution and advice
191,strong 7.9 quake hits costa rica tsunami warning httpAddress httpAddress,Caution and advice
192,usrId cancelan alerta d tsunami activada de #centroamrica a #brasil tras fuerte sismo de 7 6 q sacudi #costarica httpAddress,Caution and advice
193,rt usrId shoa entreg horarios de arribo a chile de oleaje por terremoto en costa rica httpAddress,Caution and advice
194,rt usrId rt usrId #breaking a magnitude 7.9 earthquake has struck off the coast of costa httpAddress a tsunami watch is in effect fo ..,Caution and advice
195,pura httpAddress rt usrId powerful earthquake hits northern costa rica triggers tsunami warning httpAddress,Caution and advice
196,rt usrId #breaking 7.9 earthquake hits off the coast of costa rica tsunami watch in httpAddress,Caution and advice
197,rt usrId urgente #terremoto de 7 9 grados sacude la costa de costa httpAddress existe alerta de #tsunami para la costa del pac fico h ..,Caution and advice
198,rt usrId aviso de tsunami en el caribe tras un terremoto de 7 9 cerca de costa rica httpAddress,Caution and advice
199,rt usrId magnitud terremoto en costa rica es de 7 6 y se levantan las alertas de httpAddress el shoa dar posible httpAddress,Caution and advice
200,alerta de tsunami incluye a colombia tras terremoto de 7 6 grados en costa httpAddress,Caution and advice
201,rt usrId nacional alerta de tsunami en chile por terremoto 7.9 en costa rica httpAddress,Caution and advice
202,rt usrId forte terremoto atinge a costa rica e gera alerta de httpAddress ainda no informa es sobre v timas ou danos httpAddress,Caution and advice
203,rt usrId tsunami warning after quake strikes costa httpAddress,Caution and advice
204,rt usrId urgente un terremoto de magnitud 7 9 sacudi #costarica seg n el servicio geol gico de estados httpAddress httpAddress,Caution and advice
205,ministro hinzpeter por terremoto en costa rica en arica 17 23 estar a llegando el tsunami,Caution and advice
206,rt usrId red #earthquake alert httpAddress in #costa rica bejuco httpAddress 14 42utc pop100km 4500 tsunami 316cm smara httpAddress ..,Caution and advice
207,rt usrId terremoto 7 9 richter sacude costa rica y genera alerta de httpAddress ampliaremos httpAddress,Caution and advice
208,rt usrId terremoto de 7 9 grados richter en costa rica provoca alerta de tsunami preventiva para costas chilenas httpAddress ..,Caution and advice
209,#tsunami warning issued for central america and parts of south america after 7.6 magnitude quake in costa httpAddress httpAddress,Caution and advice
210,rt usrId chile interior minister hinzpeter says not yet issuing evacuation order for country s coastline following costa rica quake ..,Caution and advice
211,rt usrId #tsunami warnings remain in effect for costa rica panama and nicaragua after the now httpAddress quake httpAddress,Caution and advice
212,rt usrId ltima hora aviso de tsunami en el caribe tras un terremoto de 7 9 cerca de costa rica httpAddress,Caution and advice
213,rt usrId quake update cnn reporting that all tsunami warnings have been reduced for the costa rica httpAddress,Caution and advice
214,rt usrId #tsunami warnings remain in effect for costa rica panama and nicaragua after the now httpAddress quake httpAddress,Caution and advice
215,#costarica #tsunami advisory no tsunami waves reported yet be on alert ! precautionary evacuation recommended ! #earthquake #ptwc,Caution and advice
216,costa rica es #tt en jap n por el terremoto de 7.6 con alerta de tsunami que ha sucedido hace unos httpAddress,Caution and advice
217,rt usrId breaking powerful httpAddress earthquake reported in costa httpAddress,Caution and advice
218,rt usrId #envivo descartan riesgo de tsunami para per tras terremoto de 7.6 en #costa rica httpAddress,Caution and advice
219,rt usrId hinzpeter descarta por ahora una evacuaci n ante posible tsunami por terremoto en costa rica gt ; httpAddress ..,Caution and advice
220,terremoto de magnitud 7 6 sacude costa rica httpAddress #cnn v a usrId #fb,Caution and advice
221,rt usrId just in usgs reports 7.9 magnitude earthquake off the coast of costa httpAddress tsunami watch issued for the httpAddress,Caution and advice
222,usrId centro advertencia tsunamis pac fico retira alerta tsunami para caribe tras #sismo #costarica mantiene advertencia r ..,Caution and advice
223,rt usrId usgs major earthquake hits #costarica tsunami warning httpAddress httpAddress usrId #latinamerica,Caution and advice
224,breakingnews caribbean wide tsunami watch in effect after costa rican quake pacific tsunami warning center usrId usrId,Caution and advice
225,rt usrId chile emite alerta de tsunami para sus costas tras terremoto de costa rica httpAddress,Caution and advice
226,earthquake of 7.6 hits costa httpAddress tsunami warning,Caution and advice
227,rt usrId alerta de tsunami incluye a colombia tras terremoto de 7 6 grados en costa httpAddress,Caution and advice
228,alerta de tsunami en el sur por terremoto de costa rica,Caution and advice
229,rt usrId sismo terremoto 7 6 grados richter se registr en costa httpAddress shoa confirma alerta de tsunami para chile httpAddress ..,Caution and advice
230,alerta de tsunami tras un terremoto de 7 9 cerca de costa rica httpAddress httpAddress,Caution and advice
231,terremoto de magnitud 7 6 sacude costa rica httpAddress #cnn v a usrId alerta de tsunami,Caution and advice
232,rt usrId ltima hora alerta de tsunami incluye a colombia tras terremoto de 7 6 grados en costa httpAddress,Caution and advice
233,rt usrId actualizado terremoto de 7 6 sacudi a costa httpAddress onemi mantiene la alerta de tsunami para las costas de httpAddress httpAddress ..,Caution and advice
