234,forte terremoto atinge a costa rica e gera alerta de tsunami httpAddress,Caution and advice
235,terremoto 7 6 richter sacude costa rica alerta de tsunami terra chile httpAddress v a usrId,Caution and advice
236,rt usrId cancelan alerta de tsunami activada desde #centroamrica hasta #brasil tras fuerte sismo de 7 9 que sacudi #costarica http ..,Caution and advice
237,rt usrId usrId capitn de la marina descarta riesgo de tsunami para per tras terremoto de 7.6 en #costa rica httpAddress ..,Caution and advice
238,rt usrId caribbean tsunami alert issued after powerful httpAddress quake rocks costa httpAddress,Caution and advice
239,rt usrId usrId usrId tsunami warning in caribbean cancelled following costa rican earthquake ; was meant for pacific ocean,Caution and advice
240,rt usrId no tsunami threat to hawaii after mag 7.6 earthquake rocks costa rica,Caution and advice
241,rt usrId la alerta de tsunami contin a para costa rica panam nicaragua httpAddress #temblorcr,Caution and advice
242,alerta de tsunami para las costas de chile tras terremoto en costa rica httpAddress v a usrId,Caution and advice
243,#actualidad chile emite alerta de tsunami para sus costas tras terremoto de costa rica httpAddress,Caution and advice
244,rt usrId ltima hora alerta de tsunami incluye a colombia tras terremoto de 7 6 grados en costa httpAddress,Caution and advice
245,rt usrId reiteramos la dhn de la marina del per descart tsunami en nuestras costas por el terremoto en costa rica httpAddress ..,Caution and advice
246,rt usrId publica en este momento q hay alerta d tsunami para #chile por terremoto en #costarica httpAddress,Caution and advice
247,rt usrId 7.6 #quake off coast of costa rica 83km sth of liberia tsunami watch issued httpAddress #thebuzz,Caution and advice
248,se establece alerta de tsunami para las costas de chile por terremoto en costa rica,Caution and advice
249,rt usrId fuerte terremoto en costa rica y alerta informativa de tsunami en chile llegar a a #iquique alas 17 30 horas http ..,Caution and advice
250,major earthquake hits costa rica tsunami warning issued httpAddress,Caution and advice
251,rt usrId live coverage httpAddress earthquake rattles the coast of costa rica ; tsunami watch for caribbean in effect httpAddress ..,Caution and advice
252,rt usrId #emergencymessage via usrId #tsunami warning for #elsalvador #panama #nicaragua #mexico #costarica amp ; httpAddress ht ..,Caution and advice
253,rt usrId actualizado terremoto de 7 6 sacudi a costa httpAddress onemi mantiene la alerta de tsunami para las costas de httpAddress httpAddress ..,Caution and advice
254,costa rica quake downgraded to httpAddress no immediate reports of httpAddress tsunami warning lifted for caribbean still in place for httpAddress,Caution and advice
255,rt usrId tras el sismo de 7 9 en #costarica hay alerta de #tsunami para toda la zona costera desde #centroamrica hasta #brasil http ..,Caution and advice
256,rt usrId #emergencymessage via usrId #tsunami warning for #elsalvador #panama #nicaragua #mexico #costarica amp ; httpAddress ht ..,Caution and advice
257,rt usrId costa rica official there s chaos in san jose because it was a strong earthquake of long duration httpAddress mm,Caution and advice
258,rt usrId urgente terremoto en costa rica de httpAddress aviso de tsunami costa rica panama nicaragua el salvador honduras mexico ..,Caution and advice
259,el shoa cancel la alerta de #tsunami en chile por el terremoto en costa rica httpAddress,Caution and advice
260,rt usrId el shoa cancel la alerta de #tsunami en chile por el terremoto en costa rica httpAddress,Caution and advice
261,rt usrId a propo del reciente terremoto en costa rica de casi D grados httpAddress tips en prevenci n de desastres httpAddress ..,Caution and advice
262,powerful quake hits costa rica tsunami warning issued httpAddress,Caution and advice
263,rt usrId httpAddress un terremoto de magnitud 7 9 sacudi #costarica seg n el servicio geol gico de estados unidos v a usrId vi ..,Caution and advice
264,rt usrId breaking major quake hits near costa rica coast ; caribbean wide tsunami watch issued httpAddress,Caution and advice
265,rt usrId alerta de tsunami para costa chilena tras terremoto en costa rica el movimiento tuvo una magnitiud de 7 6 httpAddress ..,Caution and advice
266,rt usrId nacional terremoto en costa rica informe cancela alerta de tsunami para chile httpAddress,Caution and advice
267,usrId atenci n levantan alerta de tsunami en el per tras fuerte sismo que sacudi #costarica usrId are you ok ? omg,Caution and advice
268,terremoto de magnitude 7 6 atinge costa rica ; emitido alerta de tsunami,Caution and advice
269,rt usrId tras el sismo de 7 9 en #costarica hay alerta de #tsunami para toda la zona costera desde #centroamrica hasta #brasil http ..,Caution and advice
270,alerta de tsunami en el pac fico tras un fuerte terremoto en costa rica httpAddress v a usrId,Caution and advice
271,earthquake strikes off costa rica coast a tsunami warning has been issued after a powerful earthquake httpAddress httpAddress,Caution and advice
272,rt usrId tsunami warning issued after costa rica quake httpAddress,Caution and advice
273,rt usrId magnitude 7.6 quake strikes west coast of costa rica httpAddress tsunami info here httpAddress,Caution and advice
274,rt usrId tras el sismo de 7 9 en #costarica hay alerta de #tsunami para toda la zona costera desde #centroamrica hasta #brasil http ..,Caution and advice
275,rt usrId no hay alerta de tsunami para el httpAddress terremoto fue en el pacifico a 8km 5mi al ne de samara costa rica,Caution and advice
276,rt usrId tras el sismo de 7 9 en #costarica hay alerta de #tsunami para toda la zona costera desde #centroamrica hasta #brasil http ..,Caution and advice
277,rt usrId tsunami warning issued as powerful 7.6 quake hits costa rica httpAddress,Caution and advice
278,28 mile deep earthquake strikes an earthquake with a magnitude of 7.6 struck off the coast of costa rica httpAddress httpAddress,Caution and advice
279,rt usrId #emergencymessage via usrId #tsunami warning for #elsalvador #panama #nicaragua #mexico #costarica amp ; httpAddress ht ..,Caution and advice
280,rt usrId presidenta chinchilla reafirma en vivo que se descarta que zona costera pueda ser afectada por un httpAddress #temblorcr,Caution and advice
281,noo ! ap costa rica official there s chaos in san jose because it was a strong earthquake of long duration httpAddress mm,Caution and advice
282,rt usrId se registra un fuerte #sismo en #costarica se declar una alerta de tsunami para #costarica #panama y #nicaragua,Caution and advice
283,earthquake hits off costa rica tsunami warnings issued httpAddress,Caution and advice
284,rt usrId se levanta o retira la alerta de tsunami sobre las costas del pac fico #temblorcr,Caution and advice
285,rt usrId forte terremoto atinge costa rica e alerta de tsunami emitido at para amrica do httpAddress httpAddress,Caution and advice
286,kyodo httpAddress quake jolts costa rica regional tsunami warning issued httpAddress #japan,Caution and advice
287,alerta de tsunami en el pac fico tras un terremoto de 7 9 en costa rica httpAddress v a elpaiseconomia,Caution and advice
288,powerful quake hits costa rica tsunami warning issued yahoo ! news httpAddress via usrId,Caution and advice
289,rt usrId vigente alerta de #tsunami para #costarica #panam y httpAddress se descarta la alerta para las costas del httpAddress,Caution and advice
290,rt usrId atenci n levantan alerta de tsunami en el per tras fuerte sismo que sacudi #costarica,Caution and advice
291,rt usrId usgs cancel la vigilancia de tsunami para el caribe tras #terremoto de 7.9 que sacudi a #costarica httpAddress,Caution and advice
292,rt usrId costa rica president chinchilla says no report of loss of life so far after earthquake httpAddress,Caution and advice
293,rt usrId se descarta tsunami en colombia tras fuerte terremoto en costa httpAddress,Caution and advice
294,fuerte cismo sacudi #costarica una seal ms de que el tiempo se httpAddress,Caution and advice
295,rt usrId oficialmente se ha cancelado el alerta de #tsunami para #nicaragua #costarica y #panam #temblor #costarica,Caution and advice
296,rt usrId tsunami warning issued after costa rica earthquake httpAddress,Caution and advice
297,terremoto en costa rica no genera alerta de tsunami en el per httpAddress v a usrId,Caution and advice
298,rt usrId tsunami warning for costa rica nicaragua panama canceled after 7.6 httpAddress httpAddress,Caution and advice
299,rt usrId chile emite alerta de tsunami para sus costas tras terremoto de costa rica httpAddress,Caution and advice
300,rt usrId levantan alerta tsunami para costa rica panam y nicaragua tras terremoto httpAddress,Caution and advice
301,powerful quake hits costa rica tsunami warning issued reuters httpAddress,Caution and advice
302,tsunami warning caused by costa rica quake now canceled httpAddress,Caution and advice
303,rt usrId tras el sismo de 7 9 en #costarica hay alerta de #tsunami para toda la zona costera desde #centroamrica hasta #brasil http ..,Caution and advice
304,usrId entre #tsunami y terremotos en #costarica debemos estar protegidos con #guardianmovil gratis httpAddress rt por httpAddress,Caution and advice
305,rt usrId ahora ! se cancela alerta de tsunami para costa rica nicaragua y panam tras terremoto,Caution and advice
306,rt usrId alerta de tsunami tras terremoto en costa rica incluye mxico httpAddress tras el fuerte sismo httpAddress http ..,Caution and advice
307,rt usrId correccion el tri a un dia de viajar a costa rica y justo hay alerta d tsunami n el pac fico tras terremoto en httpAddress ..,Caution and advice
308,costa rica sacudida por un terremoto de magnitud 7.6 grados los costarricenses han estado tuiteando para httpAddress httpAddress,Caution and advice
309,update tsunami warnings canceled after quake in costa rica the two way npr httpAddress,Caution and advice
310,magnitude 7.6 quake shakes costa rica abc online abc newsmagnitude 7.6 quake shakes costa ricaabc onlinea httpAddress httpAddress,Caution and advice
311,rt usrId se registra un fuerte #sismo en #costarica tras el mismo se declar una alerta de tsunami para #costarica #panama y ..,Caution and advice
312,vespertino olmeca alerta de tsunami por terremoto de 7.6 grados en costa rica httpAddress,Caution and advice
313,rt usrId tras el sismo de 7 9 en #costarica hay alerta de #tsunami para toda la zona costera desde #centroamrica hasta #brasil http ..,Caution and advice
314,y la tierra tembl httpAddress terremoto en costa httpAddress foto de hoy en httpAddress httpAddress,Caution and advice
315,powerful 7.6 earthquake reported in costa rica httpAddress via usrId,Caution and advice
316,chileno en #costarica fue como un temblor fuerte pero se espera uno ms grande httpAddress,Caution and advice
317,rt usrId costa rica red cross ready for action after #earthquake httpAddress,Caution and advice
318,rt usrId tras el sismo de 7 9 en #costarica hay alerta de #tsunami para toda la zona costera desde #centroamrica hasta #brasil http ..,Caution and advice
319,situaci n actual en #costarica por #terremotocr rt usrId pa s en alerta roja tras terremoto de 7 6 httpAddress,Caution and advice
320,pnico en costa rica el temblor de 7 6 en la escala richter provoc escenas de angustia y dispar una breve httpAddress httpAddress,Caution and advice
321,rt usrId comisi n nacional de emergencias de costa rica declar alerta roja en el pa s tras terremoto de 7 6 que dej D fal ..,Caution and advice
322,massive 7.9 earthquake strikes costa rica triggering tsunami warnings httpAddress httpAddress usrId,Caution and advice
323,rt usrId tras el sismo de 7 9 en #costarica hay alerta de #tsunami para toda la zona costera desde #centroamrica hasta #brasil http ..,Caution and advice
324,reportan DD rplicas tras terremoto de magnitud 7 6 en costa rica,Caution and advice
325,costa rica escapes serious damage from big quake httpAddress,Caution and advice
326,rt usrId un fuerte terremoto de magnitud 7 6 sacude costa rica y se siente en panam y nicaragua httpAddress httpAddress,Caution and advice
327,rt usrId #costarica en tensa calma tras el sismo de magnitud 7 6 ; se han registrado ms de DD rplicas y siguen evaluando daos http ..,Caution and advice
328,rt usrId declaran alerta verde en nicaragua por enjambre s smico en el lago de httpAddress estar a ligado al terremoto de costa rica,Caution and advice
329,rt usrId earthquakes in southern central california today not triggered by httpAddress quake in costa rica usrId httpAddress ..,Caution and advice
330,terremoto de 7.9 en costa rica alerta de tsunami httpAddress,Caution and advice
331,costa rica earthquake magnitude DD tremor sets off tsunami warning along coastlines httpAddress #news,Caution and advice
332,the watchers massive costa rican earthquake awakens nicaraguan apoyeque volcano httpAddress,Caution and advice
333,interesting breakingnews magnitude 5.6 earthquake hits near hojancha costa rica usgs httpAddress httpAddress please rt,Caution and advice
334,costa rica earthquake awakens nicaraguan volcano which last erupted in DD httpAddress alert level raised httpAddress,Caution and advice
335,usrId httpAddress quake strikes costa rica tsunami warnings issued httpAddress httpAddress mientras httpAddress,Caution and advice
1123,rt usrId httpAddress 14 24 hlv httpAddress 3.1 mw a DD km al suroeste de san cristobal httpAddress httpAddress w httpAddress httpAddress km,Caution and advice
1124,usrId httpAddress 14 24 hlv httpAddress 3.1 mw a DD km al suroeste de san cristobal httpAddress httpAddress w httpAddress httpAddress km,Caution and advice
1125,rt usrId D . 5 earthquake 49km sw of champerico httpAddress nov D 10 35 at epicenter 6m ago depth httpAddress httpAddress,Caution and advice
1126,rt usrId #sismo recuerde no grite no corra no empuje y dir jase a una zona httpAddress #oaxaca #mexico #edomex #df #chiapas,Caution and advice
1127,rt usrId sismo se percibe en mexico y guatemala al momento no hay heridos 7 5 ricther,Caution and advice
1128,rt usrId seg n la usgs un sismo de 7 5 richter sacudi centroamrica frente a httpAddress el sismol gico de mxico lo cifr en ..,Caution and advice
1129,terremoto en guatemala 7 5 no hay alerta de tsunami para las costas del pasifico,Caution and advice
1130,rt usrId magnitude 7.5 quake hits off guatemala s pacific coast usgs,Caution and advice
1131,rt usrId sismo de mas de D puntos en guatemala costa del pacifico,Caution and advice
1132,un sismo de 7 5 grados en la escala de richter se registr en httpAddress el movimiento s smico tambin se sinti en httpAddress,Caution and advice
1133,rt usrId ltima hora temblor de 7.4 grados a DD kil metros de #champerico httpAddress,Caution and advice
1134,usrId 7.5 earthquake off the coast of guatemala pwta reports httpAddress no tsunami alert httpAddress,Caution and advice
1135,rt usrId ltima hora un terremoto de magnitud 7 3 sacude la costa del pac fico de guatemala,Caution and advice
1136,rt usrId presidenteoj se suspenden las actividades en la torre de tribunales por el d a de httpAddress #temblorgt,Caution and advice
1137,rt usrId el centro de alerta de tsunami de estados unidos emite alerta de tsunami para chiapas y guatemala tras sismo httpAddress ..,Caution and advice
1138,strong earthquake hits guatemala coast usgs httpAddress,Caution and advice
1139,rt usrId ampliaci n un terremoto de magnitud 7 5 sacude la costa del pac fico de guatemala httpAddress v a usrId,Caution and advice
1140,rt usrId sismo de 7.5 httpAddress hay alerta de tsunami en el httpAddress sensible en guatemala el salvador y httpAddress,Caution and advice
1141,rt usrId rt primerimpacto fuerte sismo en guatemala el salvador y mxico httpAddress,Caution and advice
1142,rt usrId alert strong earthquake reported in guatemala httpAddress,Caution and advice
1143,rt usrId presidente otto prez declara alerta roja en toda guatemala por httpAddress,Caution and advice
1144,rt usrId presidente otto prez declara alerta roja en toda guatemala por httpAddress,Caution and advice
1145,rt usrId presidente otto prez molina declara alerta roja en toda guatemala por httpAddress indica que hay posibilidad de httpAddress,Caution and advice
1146,terremoto sacude mxico guatemala y el httpAddress alerta de tsunami para la costa httpAddress,Caution and advice
1147,rt usrId conredguatemala declara alerta roja departamental en san marcos #guatemala #sismogt,Caution and advice
1148,rt usrId presidente otto prez molina declara alerta roja en toda guatemala por sismo #temblorgt,Caution and advice
1149,rt usrId #sismo no se estacione junto a postes edificios u otros elementos que presenten httpAddress #mexico #df #edomex #chiap ..,Caution and advice
1150,rt usrId guatemala en alerta roja por sismo hay httpAddress el salvador y nicaragua alerta de httpAddress pendientes y tranquilidad,Caution and advice
1151,rt usrId #guatemala presidente usrId suspende actividades p blicas y ordena evacuar edificios #rt,Caution and advice
1152,presidente otto prez declares red alert in all of the country of httpAddress insivumeh removed the tsunami httpAddress httpAddress,Caution and advice
1153,rt usrId el presidente de #guatemala dice que hay alerta de tsunami viviendas totalmente destruidas y eval an posibles muertes httpAddress ..,Caution and advice
1154,rt usrId presidente otto prez molina declara alerta roja en toda guatemala por sismo #temblorgt,Caution and advice
1155,rt usrId ltima hora nicaragua emite una alerta de tsunami por el se smo en guatemala #terremoto,Caution and advice
1156,rt usrId #sismo nicaragua emite alerta de httpAddress hacen llamado a la poblaci n para la movilizaci n hacia las zonas httpAddress ..,Caution and advice
1157,rt usrId #sismo nicaragua emite alerta de httpAddress hacen llamado a la poblaci n para la movilizaci n hacia las zonas httpAddress ..,Caution and advice
1158,httpAddress spam filtered category 7.4 earthquake strikes off coast of guatemala httpAddress,Caution and advice
1159,rt usrId el presidente de #guatemala dice que hay alerta de tsunami viviendas totalmente destruidas y eval an posibles muertes,Caution and advice
1160,nicaragua emite alerta de tsunami tras el fuerte sismo en costas de guatemala rcn radio httpAddress v a usrId,Caution and advice
1161,nicaragua lanzan alerta de tsunami tras terremoto de 7 4 grados en guatemala la tensi n impera en httpAddress httpAddress #per,Caution and advice
1162,rt usrId presidente de #guatemala informa que ya hay ms de D mil miembros del ejrcito en san marcos ayudando a damnificados ..,Caution and advice
1163,pdte de #guatemala usrId pide a poblaci n que evite zonas en las que que haya concentraci n de gente por posibles httpAddress,Caution and advice
1164,temblor y alerta de tsunami en guatemala hagamos cadena de oraci n para que no sobreviva ricardo httpAddress,Caution and advice
1165,un sismo en httpAddress de 7.4 httpAddress,Caution and advice
1166,httpAddress httpAddress earthquake offshore guatemala no tsunami warning httpAddress via usrId,Caution and advice
1167,rt usrId 5.1 earthquake 54km sw of champerico httpAddress nov D 16 42 at epicenter 21m ago depth httpAddress httpAddress,Caution and advice
1168,rt usrId #oyenteseu reportan una rplica del terremoto en sectores de #sanmarcos y httpAddress usrId y usrId ..,Caution and advice
1169,#temblor m httpAddress 13km ssw of champerico guatemala httpAddress #earthquake #sismo,Caution and advice
1170,rt usrId ms de DD mil empleados de salud estn en alerta por terremoto en guatemala httpAddress v a usrId,Caution and advice
1171,rt usrId #cuba emiten advertencia de posible tsunami por fuerte sismo en costas de guatemala el sismo de 7 5 .. httpAddress ..,Caution and advice
1172,decreta presidente de guatemala alerta roja por temblor el presidente de guatemala otto httpAddress httpAddress por linea directa,Caution and advice
1173,rt usrId sismo ms de DD rplicas se registran en guatemala tras sismo de 7.2 de la httpAddress magnitudes desde 3.5 hasta 4.9 gra ..,Caution and advice
1174,rt usrId care are on the ground assessing the situation after a 7.2 #earthquake hit #guatemala,Caution and advice
1175,sismo anoche #sismo httpAddress 3.8 en maracaibo,Caution and advice
1176,ampl an estado de calamidad a siete departamentos de guatemala por el terremoto httpAddress,Caution and advice
1177,rt usrId conred reporta sismo a las 6 43 hrs con magnitud de 4.3 grados escala de richter a DD httpAddress de oc s sm httpAddress #larevi ..,Caution and advice
1178,rt usrId DD voluntarios y tcnicos evaluarn los daos que dej el #temblorgt #sismogt lee la nota httpAddress http ..,Caution and advice
1179,hoy 16 20hs reporte preliminar del sismo por usrId es 6 4 richter recuerden mantener la calma amigos de httpAddress,Caution and advice
1180,rt usrId ltima hora un sismo de 6.2 grados richter cimbra guatemala httpAddress,Caution and advice
1181,rt usrId #ahora un fuerte sismo con magnitud de 6.2 grados richter sacude #guatemala inform el usgs,Caution and advice
1182,httpAddress earthquake strikes off guatemala s western coast a httpAddress earthquake struck this httpAddress httpAddress,Caution and advice
1183,rt usrId sismo de magnitud 6 2 con epicentro en guatemala sacude el salvador httpAddress,Caution and advice
1184,#quevuelvarctv sismo de magnitud 6.2 sacude guatemala httpAddress,Caution and advice
1185,rt usrId un #sismo de 6 0 richter se registr frente a la costa de aysn httpAddress,Caution and advice
1186,hoy habr #terremotogt por ser martes 13 los temblores eran una introduccion,Caution and advice
1187,#chile DD km al e de tierra amarilla preliminar si magnitud 4.8 profundidad DD km hora cerca del httpAddress httpAddress #sismo v,Caution and advice
1188,#usgs #breaking m httpAddress 47km s of champerico guatemala httpAddress #pasthour #48 #earthquake #tsunami #prayfromjapan,Caution and advice
1189,rt usrId 4.5 earthquake 67km ssw of ocos httpAddress nov DD 00 47 at epicenter 34m ago depth httpAddress httpAddress,Caution and advice
1190,#sismo a DD km al o de navidad preliminar si magnitud 3.8 profundidad DD km hora cerca httpAddress httpAddress #innova virtual news,Caution and advice
1191,#sismo #temblor arica fuerte sismo pronosticado por red quake alert,Caution and advice
1192,rt usrId alerta #sismo con magnitud httpAddress 225km ssw en panenggoede #indonesia,Caution and advice
1193,alerta #sismo con magnitud httpAddress 14km n en meadow lakes #alaska,Caution and advice
1889,rt usrId #terremoto #map httpAddress,Caution and advice
1890,rt usrId strong earthquake northern italy may 20 02 03 utc DD #terremoto httpAddress httpAddress,Caution and advice
1891,rt usrId httpAddress earthquake strikes near bologna italy the earthquake had initially registered at magnitude httpAddress httpAddress ..,Caution and advice
1892,#terremoto #venezia non ho pi avvertito scosse,Caution and advice
1893,rt usrId sembra ci siano seri danni a finale emilia e poggio renatico #terremoto,Caution and advice
1894,rt usrId cosa fare e non fare in caso di #terremoto ma molto va fatto prima es cosa banale da anni non ho quadri sul letto ..,Caution and advice
1895,rt usrId rt usrId #terremoto piazza maggiore affollata alle D di mattina httpAddress,Caution and advice
1896,rt usrId revised httpAddress gt ; httpAddress 6.0 earthquake northern httpAddress may DD 4 03am at epicenter 1h 31m ago 36km nnw of bologna ..,Caution and advice
1897,a causa del #terremoto nella zono di ancona i treni per la zona centro nord hanno ritardi o httpAddress,Caution and advice
1898,rt usrId #terremoto molise 2002 l aquila 2009 emilia httpAddress tutti di 5 9 gradi httpAddress #riflessioni,Caution and advice
1899,rt usrId 059 200200 il numero unico della protezione civile per assistenza zona #modena httpAddress ritwittate e mettetelo ..,Caution and advice
1900,rt usrId #terremoto protezione civile emilia romagna httpAddress httpAddress httpAddress httpAddress numero verde 800 33 911 solo emerg ..,Caution and advice
1901,rt usrId 059 200200 il numero unico della protezione civile per assistenza zona #modena httpAddress ritwittate e mettetelo ..,Caution and advice
1902,rt usrId #sisma in #emiliaromagna vertice della #protezione civile a #ferrara e a #modena #terremoto httpAddress,Caution and advice
1903,rt usrId i media in silenzio fino alle 6 solo twitter stanotte supportava e informava la gente httpAddress #terremoto #vergogna,Caution and advice
1904,rt usrId usrId #terremoto 059 200200 il numero unico della protezione civile per assistenza zona #modena aiuta a ..,Caution and advice
1905,rt usrId usrId #terremoto 059 200200 il numero unico della protezione civile per assistenza zona #modena aiuta a ..,Caution and advice
1906,rt usrId usrId #terremoto 059 200200 il numero unico della protezione civile per assistenza zona #modena aiuta a ..,Caution and advice
1907,rt usrId #terremoto altre segnalazioni di scosse in emilia .. D httpAddress httpAddress 053D 771546 e 053D 771585 per segnalare emergenze ..,Caution and advice
1908,rt usrId #terremoto httpAddress 2012 05 20 13 21 06 utc httpAddress httpAddress httpAddress prov rovigo modena ferrara,Caution and advice
1909,rt usrId attenzione 059 200200 il numero unico della protezione civile per assistenza zona #modena httpAddress ritwittare e ..,Caution and advice
1910,rt usrId attenzione 059 200200 il numero unico della protezione civile per assistenza zona #modena httpAddress ritwittate tutti !,Caution and advice
1911,#terremoto a #reggioemilia domani aperte scuole primarie scuole infanzia e nidi dopo sopralluoghi ok da #comunere,Caution and advice
1912,rt usrId per il #terremoto ci sono due numeri per segnalare le emergenze 0532 771546 e httpAddress spero possano essere ut ..,Caution and advice
