item_id,item,label
5259,nepals landmarks before and after the earthquake httpAddress,Infrastructure and utilities
5261,nepal earthquake three welshmen still missing as death tolls passes 3 00 adrian summers httpAddress httpAddress #thisiswales,Other Useful Information
5262,seems great bond between modi and httpAddress httpAddress raised him nationally nepal quake may promote him httpAddress,Not related or irrelevant
5263,watch the first israelis return from nepal three premature babies their parents and a hiker who was httpAddress httpAddress,Not related or irrelevant
5265,nepalese people gather to cremate their family members who died in the earthquake in bhaktapur near kathmandu httpAddress httpAddress,Other Useful Information
5266,everest climbers are killed as nepal quake sets off avalanche httpAddress,Not related or irrelevant
5267,nepal kicks off religious festival by slaughtering 5 00 buffalo httpAddress,Not related or irrelevant
5268,dan fredinburg diretor do google morre no terremoto do httpAddress httpAddress,Not related or irrelevant
5270,anyone available ? httpAddress,Not related or irrelevant
5271,some destructions of #nepalearthquake #letshelpnepal #letsactindonesia via usrId httpAddress,Not related or irrelevant
5274,nepal quake death toll rises above 3 400 httpAddress,Not related or irrelevant
5275,#nepalearthquake don t rebuild pagan hindu temples convert to christianity httpAddress,Not related or irrelevant
5276,morons who are saying that pm is helping #nepal bcz its a hindu state they must remember gt ; 75 evacuated in #yemen were muslims ! #thankyoupm,Not related or irrelevant
5277,#nepalquake amp ; #peshawarrain are clear warnings there are no guarantees in life return to #allah ask forgiveness # tauba before its to late,Not related or irrelevant
5278,yes you are httpAddress httpAddress,Not related or irrelevant
5279,pray for nepal,Not related or irrelevant
5280,usrId is this because you were with google ?? can t understand why this ? httpAddress,Not related or irrelevant
5281,another famous belgian ! horrah ! httpAddress,Not related or irrelevant
5283,#nepalquake after losing homes people in #nepal face #landslide #heavyrains #avalanche amp ; now #foodcrisis httpAddress via usrId,Other Useful Information
5284,tell usrId and usrId to lower fares to #nepal ! httpAddress usrId usrId usrId usrId usrId,Not related or irrelevant
5285,read here to know ! httpAddress httpAddress,Not related or irrelevant
5286,nepal earthquake terrifying video shows moment avalanche hit everest base camp httpAddress #itsparto,Other Useful Information
5288,latest satellite image of nepali sky httpAddress auto tweet #weather httpAddress #satimage #nepal httpAddress,Other Useful Information
5290,telugu actor k . vijay dies in nepalearthquake httpAddress,Other Useful Information
5291,rt naturenews the science behind the devastating #nepalearthquake httpAddress httpAddress,Other Useful Information
5292,bbc news fears for nepal s invisible tibetan refugees httpAddress,Other Useful Information
5293,sm bsp leaders r saying usrId shud be more concious for nepal 0 bloody retards bsp #thankyoupm,Not related or irrelevant
5296,god are not those we worships god are those who save himself from any httpAddress u do not understand see nepal httpAddress,Not related or irrelevant
5297,they httpAddress httpAddress,Not related or irrelevant
5299,raheel bhai teamtwitterindia ki jai ho ! commendable dedication focus co ordination httpAddress zor laga httpAddress httpAddress,Not related or irrelevant
5301,thoughts are with the people of httpAddress,Not related or irrelevant
5302,bhimsen tower #nepalquake original vs earthquaked #nepalearthquake httpAddress,Other Useful Information
5303,httpAddress this is httpAddress just cos they aren t christian they deserved that quake ? that is such christian thinking,Not related or irrelevant
5304,etakaram team dance master vijay died at earth quake in nepal cvr news httpAddress via usrId,Other Useful Information
5305,bless him httpAddress,Not related or irrelevant
5307,nepal international aid response hampered by aftershocks offers of help are pouring in as countries httpAddress httpAddress #video,Other Useful Information
5308,heartbreaking the people amp ; history earthquake destroys kathmandu s centuries old landmarks thinkprogress httpAddress,Other Useful Information
5310,mea pmo and mod are working their ass httpAddress first isis then yemen and now httpAddress let us respect httpAddress jai httpAddress #indiawithnepal,Not related or irrelevant
5311,surprisingly haven t received emails from fancy ngos requesting donations for httpAddress,Not related or irrelevant
5312,usrId ppl of #nepal amp ; some parts f india r really n trouble govt f india amp ; many orgniztns r standng by their side that s httpAddress,Not related or irrelevant
5314,usrId kathmandu airport operating ?,Other Useful Information
5317,pray for nepal f,Not related or irrelevant
5318,sure helps to have live tv wifi amp ; power on usrId plane into httpAddress helps catch up on things before coming into #nepalquake httpAddress,Not related or irrelevant
5319,this is our message #prayfornepal httpAddress,Not related or irrelevant
5321,nepal earthquake parliament observes two minute silence httpAddress,Other Useful Information
5323,usrId why an either httpAddress or choice ? all is httpAddress all is httpAddress grace amp ; resources for our friends in nepal !,Not related or irrelevant
5327,yes let s pray httpAddress,Not related or irrelevant
5328,wish it was D month earning and not salary httpAddress,Not related or irrelevant
5329,#everest avalanche video shows moment terrified climbers scrambled for cover httpAddress httpAddress,Not related or irrelevant
5331,prayer goes out to nepal,Not related or irrelevant
5332,#china uses its massive army to frighten it s neighbors whereas #india uses its army in rescuing it s neighbors #indiawithnepal #thankyoupm,Not related or irrelevant
5333,strong aftershock hits kathmandu during interview httpAddress,Other Useful Information
5334,4 thoughts amp ; prayers httpAddress lives httpAddress #nepalearthquake,Not related or irrelevant
5335,#nepalearthquake #mx evening daily #melbourne httpAddress,Not related or irrelevant
5336,maps of disaster hit regions of nepal are available here httpAddress httpAddress,Other Useful Information
5337,it s really tragic that how nepalese are passing their days after the httpAddress httpAddress,Other Useful Information
5338,what faces those who rush to nepal victims amp ; #039 ; aid httpAddress #trending #startups #londonmarathon #news,Other Useful Information
5339,lets ask help and accept help as well to rebuild home and lives #nepalquake #day3 httpAddress,Not related or irrelevant
5342,our deep condolences for httpAddress lets pray for our friends httpAddress httpAddress stay strong httpAddress #prayfornepal httpAddress,Not related or irrelevant
5343,me httpAddress httpAddress,Not related or irrelevant
5346,people who said only idoits climb #everest such a waste of both money n httpAddress already reached mount everest in httpAddress #nepalquake,Not related or irrelevant
5347,btw bosir #prayfornepal . hope everything gonna be alright httpAddress usrId,Not related or irrelevant
5348,not often that a leading newspaper will headline with a call for prayers usrId #prayfornepal usrId httpAddress,Not related or irrelevant
5350,feeling devastated in kathmandu httpAddress,Not related or irrelevant
5351,ian s bff risk her life in nepal than attending his httpAddress what ?,Not related or irrelevant
5352,nepal s architectural jewels destroyed many of the dozens of historic temples and httpAddress #world,Not related or irrelevant
5353,praying for everyone in #nepal httpAddress,Not related or irrelevant
5354,dan fredinburg diretor do google morre no terremoto do nepal httpAddress,Not related or irrelevant
5355,mention must be made of the httpAddress they are bravely covering the disaster from the httpAddress thanks ! pm modi #nepalearthquake #indiawithnepal,Not related or irrelevant
5356,usrId can you confirm british nationals can travel to httpAddress httpAddress,Other Useful Information
5357,major earthquake hits nepal httpAddress,Not related or irrelevant
5358,the surrounding building is ok and how come the collapsed debris don t reflect the building color ? httpAddress,Infrastructure and utilities
5359,asia pacific is world s most disaster prone region counting theeconomic cost of natural disasters httpAddress #nepalquake,Not related or irrelevant
5361,pm modi ji for matrey mission to nepal whole country and almighty god is with you please proceed with full stamina it is an ..,Not related or irrelevant
5364,quake warnings of minutes possible but pricey nepal s record of earthquakes dates to at httpAddress,Not related or irrelevant
5365,#thankyoupm from nepal,Not related or irrelevant
5366,amateur footage appears to show everest climbers being brought to safety by helicopter httpAddress httpAddress,Other Useful Information
5367,top nepal experts one should follow httpAddress,Not related or irrelevant
5369,i know information nepalearthquake and many peoples death don t forget guys players for people nepal keep strong always #playfornepal,Not related or irrelevant
5371,i would imagine that there is risk of public anger in kathmandu in coming days if ppl remain without food water httpAddress visible govt impt,Other Useful Information
5372,the massive earthquake that struck #nepal have destroyed most of the major cities killing more than httpAddress,Not related or irrelevant
5373,you china bigot usrId obviously does not know where nepal is and how close it is to china ! they are neighbors stupid !,Not related or irrelevant
5374,dhiraagu prepaid amp ; postpaid customers can make free calls to all mobiles and landlines in #nepal till DD april httpAddress #nepalearthquake,Other Useful Information
5375,im out of words #prayfornepal,Not related or irrelevant
5376,. ndtv dalai lama saddened over #nepalearthquake httpAddress httpAddress who is happy ??,Not related or irrelevant
5377,httpAddress nepal earthquake poses challenge to international aid agencies the united states httpAddress httpAddress,Not related or irrelevant
5379,rain likely for next DD hours httpAddress,Other Useful Information
5380,seven women die in #nepal s earthquake httpAddress #zippednews httpAddress,Not related or irrelevant
5381,rip nepal s soul,Not related or irrelevant
5382,usrId he was usrId airport yesterday httpAddress expecting him to be back httpAddress,Other Useful Information
5383,#latest news before and after devastating earthquake wipes off important monuments in nepal httpAddress httpAddress #world news,Not related or irrelevant
5386,aerial images show quake damage httpAddress,Infrastructure and utilities
5387,prayfornepal httpAddress,Not related or irrelevant
5389,the victims of the nepal earthquake httpAddress,Not related or irrelevant
5392,nepal praying for httpAddress purposeful httpAddress,Not related or irrelevant
5393,is this truth of religion ? try D turn tragedies into brain washing events irrespective of httpAddress of all religions httpAddress,Not related or irrelevant
5394,support children and families in nepal earthquakes through #unicef httpAddress,Not related or irrelevant
5395,usrId usrId httpAddress history may teach do people learn ?,Not related or irrelevant
5398,httpAddress dunno how you do it . httpAddress no such thing as giving fatigue for your audience #nepal,Not related or irrelevant
5399,the president of usrId conveys deepest sympathies to the people of httpAddress httpAddress httpAddress,Not related or irrelevant
5400,turn to #allah before you return to #allah #nepalearthquake #peshawartornado,Not related or irrelevant
5401,plz help #prayfornepal f b f b f b httpAddress,Not related or irrelevant
5402,truth httpAddress be real because the disaster is real httpAddress,Not related or irrelevant
5403,just collected some money at work for our cleaner who s from httpAddress he looks so devastated yet he s still at work #prayfornepal,Not related or irrelevant
5404,what has happened to nepal is truly httpAddress please donate any amount you can at httpAddress,Not related or irrelevant
5405,usrId usrId usrId mother amp ; sons r missin in httpAddress ph 9815914687 mother no 009779803658023 rt httpAddress,Other Useful Information
5406,#nepalquakerelief starts frm httpAddress,Not related or irrelevant
5408,hearing about death tolls rising day after day we re still traumatized til this day and that was DD yrs httpAddress definitely praying for nepal 2,Not related or irrelevant
5409,please share httpAddress httpAddress,Other Useful Information
5410,rip nepal so sad,Not related or irrelevant
5412,climbing team on mt . everest safe after nepal quake usa today,Other Useful Information
5413,#prayfornepal earthquake,Not related or irrelevant
5416,a crack on the road near my httpAddress #nepalquake httpAddress,Infrastructure and utilities
5417,hope so man is so lucky nepal tragedy overshadowed the rally murders #media dumped the the issue totally .. httpAddress,Not related or irrelevant
5419,fuller epicenter httpAddress,Not related or irrelevant
5421,#news #nepal death toll passes httpAddress #gay row #healthminister httpAddress #climber caught up in #nepal httpAddress httpAddress,Not related or irrelevant
5422,usrId what say we can help !! just needs a httpAddress #helpnepal #prayfornepal #thankyoupm,Not related or irrelevant
5423,turn a worry into a httpAddress grateful for what you have today ! shelter that many httpAddress praying for #nepalearthquake httpAddress,Not related or irrelevant
5424,usrId he was usrId airport yesterday httpAddress expecting him to be back httpAddress,Not related or irrelevant
5425,channels won cover scores of rss volunteers helping in rebuilding nepal but will make cover story on modi s httpAddress #presstitudes,Not related or irrelevant
5426,bjp member sakshi maharaj makes stupid remark nepal earthquake due to rahul gandhi httpAddress,Not related or irrelevant
5428,. usrId #nepalearthquake aussie renu fotedar killed when avalanche washed her away at everest camp httpAddress,Not related or irrelevant
5429,#everest avalanche video shows moment terrified climbers scrambled for cover httpAddress httpAddress #napal #tcot,Not related or irrelevant
5430,httpAddress nepal we are with you httpAddress,Not related or irrelevant
5432,nepal earthquake moment avalanche hits everest mountaineers httpAddress,Not related or irrelevant
5434,hugh sheridan flies to nepal to find his little brother httpAddress,Not related or irrelevant
5435,cnn s sumnima udas reports from crumbled capital cnn s sumnima udas reports from the historic durbar square httpAddress httpAddress,Other Useful Information
5436,my mobile gps is locating my location DD km north some time or DD km south .. there is DD DD tremors in DD hours # nepal earthquake,Other Useful Information
5437,usrId 5 e httpAddress #nepal,Not related or irrelevant
5438,so apt !! httpAddress,Not related or irrelevant
5440,nepal earthquake hundreds flee capital hundreds of nepalis were fleeing the capital kathmandufor the plains on monday httpAddress,Not related or irrelevant
5441,vijay who was the choreographer of telugu comedy film #yetakaramcom dies in #nepal #earthquake httpAddress,Not related or irrelevant
5442,cnn s ivan watson lands at kathmandu airport,Not related or irrelevant
5444,httpAddress if v want to thank anyone it should b people of india who hv made nepal s pain their own amp ; extended all help modi,Not related or irrelevant
5445,thoughts and prayers to the victims of the nepal httpAddress #prayfornepal httpAddress,Not related or irrelevant
5447,how come a natural calamities be based on god ! you call #christianity bcoz they did not believe in httpAddress grow up ! #nepalearthquake,Not related or irrelevant
5449,usrId nepal so lol,Not related or irrelevant
5450,volunteering in nepal camarillo dentist shaken by quake,Not related or irrelevant
5452,this post made me cry #prayfornepal httpAddress,Not related or irrelevant
5453,usrId posts video of #avalanche at httpAddress viewers complain the swearing was beeped httpAddress 21st century httpAddress #nepalquake,Not related or irrelevant
5454,pray for nepal,Not related or irrelevant
5455,usrId dear mr. adhikari would you be available for an interview w . austrian press agency on nepal situation ? httpAddress,Not related or irrelevant
5456,#pray D #nepal ! heartiest condolences D families amp ; frds of their loved 1s who lost their httpAddress may their souls rip c c httpAddress,Not related or irrelevant
5457,another one ! httpAddress,Not related or irrelevant
5458,god knows god listen what s happening in nepal 7 #pray #for #nepal seputaran kodya httpAddress,Not related or irrelevant
5460,update httpAddress #parkminyoung # instagram update pray for nepal httpAddress,Not related or irrelevant
5462,quake aftershock measuring 6.7 shook kathmandu httpAddress,Not related or irrelevant
5463,usrId sir whatever decision you took proved that you are a great httpAddress you didn t let #nepal felt alone amp ; made india proud hatsoff,Not related or irrelevant
5464,live nepal death toll crosses 3200 over DD indians evacuated international news on twitter !!,Not related or irrelevant
5466,this is the time to help with open heart to all our nepal brothers,Not related or irrelevant
5467,#nepalearthquake quake death toll climbs to over 3 00 as locals face httpAddress httpAddress,Other Useful Information
5468,my httpAddress f d httpAddress,Not related or irrelevant
5469,once i top up the old phone wow great news httpAddress,Other Useful Information
5470,#uk #nbl #usa #news fears for nepal s invisible tibetan refugees httpAddress,Other Useful Information
5471,robbery saved D greek climbers from nepal quake pic credit afp nine greek climbers who were robbed by a sherpa httpAddress,Not related or irrelevant
5472,usrId yes helping indians is his duty but extending support to nepal isnt his official duty dats y its worthpraising #thankyoupm,Not related or irrelevant
5474,#nepalquake nearly DD #people httpAddress my prayers for the people httpAddress #nepalearthquake #donatefornepal httpAddress,Not related or irrelevant
5475,nepal quake death toll rises above 3 200 httpAddress,Not related or irrelevant
5476,major earthquake hits nepal httpAddress #nepalquake,Not related or irrelevant
5477,tt south africa 09 36 httpAddress httpAddress bible church httpAddress httpAddress to the city httpAddress httpAddress httpAddress httpAddress,Not related or irrelevant
5478,#timesofindia #toi nepal quake equivalent to DD huge atomic bombs the devastation from this earthquake was much greater than usual as the,Not related or irrelevant
5479,you seems to be head of the httpAddress usrId httpAddress,Not related or irrelevant
5480,nepal s earthquake a nightmare waiting to happen httpAddress httpAddress,Not related or irrelevant
5481,footage of everset basecamp hit by avalanche after #nepalearthquake httpAddress,Other Useful Information
5483,youtube gt ; looking for survivors in nepal httpAddress,Other Useful Information
5484,if we want to thank anyone it should be DD cr people of india who made nepal s pain their own amp ; extended all help pm modi #nepalearthquake,Not related or irrelevant
5485,earthquake survivor prayed huddled under beam journalist sunir pandey was visiting relatives with nepal s 7.8 mag httpAddress,Infrastructure and utilities
5486,massive httpAddress earthquake hits nepal over D DD fatalities httpAddress,Not related or irrelevant
5487,#nepalquakerelief i feel so much fishy i can trust only pmos relief fund still who is best so we can donate generously,Not related or irrelevant
5488,over 3 200 dead in #nepalearthquake amp ; other #headlines httpAddress,Not related or irrelevant
5490,#the independent nepal earthquake terrifying video shows moment avalanche hit everest #news details httpAddress,Not related or irrelevant
5493,nepal earthquake 2015 google exec among 2 00 ki httpAddress,Not related or irrelevant
5494,#bhutan nepal earthquake bhutan pm leaves for kathmandu india today nepal httpAddress httpAddress httpAddress,Not related or irrelevant
5495,it s time to httpAddress lets help neighbours in our surrounding living in httpAddress #help #unity #nepalquake #kathmandu,Not related or irrelevant
5496,cnn s sumnima udas reports from kathmandu httpAddress liveleakfun httpAddress,Other Useful Information
5497,thanks viber !! httpAddress,Other Useful Information
5498,usrId maybe more people should focus on real news httpAddress amp ; not care so much about #kartrashians ? httpAddress,Not related or irrelevant
5499,pray for nepal,Not related or irrelevant
5500,bit fucked how i ve seen more about bruce jenner doing his thing then the earthquake in nepal #priorities,Not related or irrelevant
5501,#arabspring maldivians fled to httpAddress #euromaidan maldivians fled to httpAddress #nepalearthquake maldivians fled to httpAddress #pussies #pathetic,Not related or irrelevant
5502,father #shyamacharangupta #mpallahabad praying D #nepalquake india victims at d sacred kalyanidevi usrId usrId httpAddress,Not related or irrelevant
5503,tough interview httpAddress no reporter with me talked to the wife of a man who died at mount everest because of the httpAddress #nepal #quake,Not related or irrelevant
5504,before and after #nepalquake httpAddress,Infrastructure and utilities
5506,all are equal but some are httpAddress httpAddress,Not related or irrelevant
5507,bangalorean prabha sridhar is relieved that her husband sridhar returned from nepal last httpAddress usrId httpAddress,Not related or irrelevant
5508,#nepal road httpAddress,Not related or irrelevant
5509,ptvph high possibility of outbreak of communicable diseases after #nepalquake 06 httpAddress,Other Useful Information
5510,dtn asia fears for nepal s invisible tibetan refugees fears for nepal s tibetan refugees httpAddress,Not related or irrelevant
5511,strong together . all of our love to #nepal in this terrible moments #namast #nepalearthquake f b httpAddress,Not related or irrelevant
5512,support nepal httpAddress,Other Useful Information
5514,DD pictures reveal nepal s heartbreaking earthquake devastation httpAddress,Other Useful Information
5515,very bad day to nepal,Not related or irrelevant
5516,quake over 3 218 feared dead ; hm team leaves for nepal new httpAddress kathmandu apr DD uni toll from the httpAddress httpAddress,Not related or irrelevant
5517,powerful aftershocks rattle nepal as aid arrives in region httpAddress httpAddress,Not related or irrelevant
5518,#nepal stary strong,Not related or irrelevant
5520,chaos at nepal airport says montreal woman stranded by earthquake httpAddress httpAddress,Other Useful Information
5521,nepal quake death toll passes 3 200 as nation struggles with devastation httpAddress httpAddress,Other Useful Information
5522,irrespective of wat #presstitutes say ! #nepalearthquake #thankyoupm #indiawithnepal httpAddress,Not related or irrelevant
5523,nepal earthquake live report httpAddress httpAddress,Other Useful Information
5524,moment nepal earthquake hit 20 photos httpAddress,Infrastructure and utilities
5525,just want this day to go by httpAddress prayfornepal,Not related or irrelevant
5526,really httpAddress httpAddress,Not related or irrelevant
5528,feeling sorry for those in httpAddress,Not related or irrelevant
5529,#nepal #uae nepali expats in the uae seek urgent travel papers httpAddress httpAddress,Other Useful Information
5530,intent nepal earthquake hundreds flee capital hundreds of nepalis were fleeing the httpAddress httpAddress,Not related or irrelevant
5531,usrId usrId not necessarily favoriting more like httpAddress not many httpAddress #prayfornepal,Not related or irrelevant
5535,can anyone update me about domestic flight status ? biratnagar to kathmandu ?,Not related or irrelevant
5536,usrId you r one of the best person in this worldaapney jo kuch v kiya nepal k leay ushkay leay hmey proud feel ho rha h . usrId,Not related or irrelevant
5538,pray for nepal httpAddress,Not related or irrelevant
5540,few indians in nepal want luxury treatment at airport even in this tragic httpAddress priority to help those who are httpAddress usrId,Not related or irrelevant
5541,presuming what the sanghi nutjobs are saying is httpAddress rg ate beef in india the earthquake shud hv taken place httpAddress nepal ? connexion ??,Not related or irrelevant
5542,omg cant believe dis death trolls from #nepalearthquake passes httpAddress its getting increased day by httpAddress,Not related or irrelevant
5543,watch raw 3 300 known dead in nepal httpAddress,Other Useful Information
5544,why are you showing same clips since last D httpAddress show rss workers helping people in httpAddress usrId usrId usrId usrId usrId,Not related or irrelevant
5545,mallus are everywhere and always in distress 4 httpAddress,Not related or irrelevant
5546,nepal map nepal satellite image physical political httpAddress,Not related or irrelevant
5547,rt usaid read the latest fact sheet from usrId on the #nepalquake and our humanitarian response httpAddress,Not related or irrelevant
5548,above all we salute resilience of our sisters brothers in nepal parts of india for courage in face of httpAddress httpAddress,Not related or irrelevant
5549,saw some people at jackson heights lighting candles for the victims in httpAddress #nepalearthquake httpAddress,Not related or irrelevant
5550,news online now body found in #keighley bus strike in #bradford amp ; #nepal earthquake latest httpAddress httpAddress,Not related or irrelevant
