item_id,item,label
2375,ustpac sends our condolences to family and friends of #nepalquake httpAddress how to help in the relief effort usrId httpAddress,Sympathy and support
2376,rt usrId passengers on tg319 flight to kathmandu arrived back at httpAddress they will attempt again at 9 15am tr usrId http,Other Useful Information
2377,rt usrId my prayers n heart goes out to all the families in nepal n india who have lost their loved httpAddress bless their soul #nep,Sympathy and support
2378,to #kathmandu and back even now when i stand up it feels as though the earth is httpAddress httpAddress #nepalquake,Other Useful Information
2380,icymi read about this #brampton woman s journey through #nepal during the #earthquake that killed upwards of 4 00 httpAddress,Affected individuals
2382,bollywood celebs pray for safety post nepal earthquake a strong earthquake measuring 7.9 on the richter scale rocked nepal at httpAddress am,Sympathy and support
2384,rt usrId shiromani gurudwara prabandhak commitie will send DD food packets from today to #nepal #indiawithnepal httpAddress,Donations and volunteering
2385,rt usrId shiromani gurudwara prabandhak commitie will send DD food packets from today to #nepal #indiawithnepal httpAddress,Donations and volunteering
2386,rt usrId a 1D year old boy is found alive in rubble D days after #nepalquake httpAddress httpAddress,Affected individuals
2389,rt usrId to support the response to #nepalquake contact the redcross or redcrescent in your country or donate through us at httpAddress,Donations and volunteering
2390,rt usrId all httpAddress DD houses have been collapsed in #barpak #gorkha epicenter of #nepalquake reports state radio reporter from #,Infrastructure and utilities
2391,rt usrId find the latest #nepalquake situation report here httpAddress,Other Useful Information
2392,rt usrId us green berets join in nepal earthquake relief httpAddress,Donations and volunteering
2393,this nepal earthquake is httpAddress 3,Other Useful Information
2394,rt usrId definite ethical issues with using #women in #india #nepal as #israel s birthing httpAddress httpAddress httpAddress,Not related or irrelevant
2395,rt usrId prolly only D people knows about nepal s earthquake in my httpAddress they re on twitter httpAddress but they ignore it cuz it s n,Other Useful Information
2396,nobody in nepals airport control tower relief materials turned away httpAddress httpAddress,Donations and volunteering
2399,rt usrId the #nepalearthquake has triggered aftershocks kolkata north india and landslides in sikkim httpAddress httpAddress,Other Useful Information
2400,rt usrId appropriate that usrId will be at #scotchforacause tonight to benefit usrId sisters in #nepal ! htt,Other Useful Information
2401,can i just say we are so caught up in whats happening in baltimore we are failing to recognize whats happening in httpAddress,Other Useful Information
2407,rt usrId please pray for usrId she s in nepal and they are affected by the httpAddress please pray for her her family and t,Sympathy and support
2408,rt usrId power is out in much of the region but many are sharing scenes amp ; stories from inside nepal httpAddress httpAddress,Other Useful Information
2409,rt usrId #nepalearthquake landing on uneven ground by iaf s mi DD v5 at simpani near httpAddress httpAddress,Other Useful Information
2410,rt usrId fake quakes the false rumours spreading online about #nepalquake httpAddress httpAddress,Other Useful Information
2411,rt usrId let us come together to pray for those affected by the earthquake in nepal and httpAddress iskcon nepal has set up a rel htt,Sympathy and support
2412,rt usrId residents of kathmandu camped out under tarps for fear of aftershocks #nepalquake httpAddress,Affected individuals
2413,httpAddress 7.8 magnitude earthquake in nepal india httpAddress china earthquake unrest obvious http httpAddresshttpAddresst . cohttpAddress78q4z6xmq4,Other Useful Information
2414,apple opened its first showroom in kathmandu nepal last march DD httpAddress #business #startups,Not related or irrelevant
2416,rt usrId let s pray for minimum life loss in #nepalearthquake .,Sympathy and support
2417,rt usrId httpAddress so many httpAddress such httpAddress httpAddress,Sympathy and support
2419,ways to help nepal s earthquake victims the following are some of the organizations providing relief in nepal to thousands of httpAddress,Donations and volunteering
2422,rt usrId nepal earthquake moves kathmandu DD feet south but everest height unchanged say experts httpAddress httpAddress,Other Useful Information
2423,rt usrId today the day the guardians of kathmandu httpAddress 15th century king pratap malla s stone httpAddress #nepalearthquake httpAddress,Affected individuals
2424,rt usrId heartbreaking to see the devastation in httpAddress,Sympathy and support
2425,rt usrId watch on usrId #redcross discusses rescue efforts in nepal httpAddress #nepalearthquake usrId usrId usrId,Other Useful Information
2426,facebook safety check lets me check on my nepali httpAddress impressive ! hope nitesh is fine ! #nepalearthquake httpAddress,Sympathy and support
2427,rt usrId pray for httpAddress may god protect httpAddress httpAddress,Sympathy and support
2429,rt usrId hahahaha teamtodiefor de gea tweeted to encourage donations to nepal and its just full of replies about a httpAddress ni,Donations and volunteering
2430,around 50 00 pregnant women affected from quake in nepal un,Affected individuals
2431,rt usrId #coinsforaustralia send all ur coins aus has unconditionally given u amp ; send D nepal u may claim legal right D kill but ur r e,Donations and volunteering
2432,rt usrId we re providing warm clothes blankets amp ; hygiene kits to children in #nepal all thanks to your amazing httpAddress http,Donations and volunteering
2433,nepal earthquake i just want to cry all i feel is hurt httpAddress,Sympathy and support
2434,hello dear brothers and sisters httpAddress pray for nepal httpAddress,Sympathy and support
2435,rt usrId yoshadhara mahabir patan ppl drying traditional sukul after last nite s httpAddress old houses down new still up . httpAddress,Infrastructure and utilities
2436,pray for nepal and the team with himalayan httpAddress our prayers are with httpAddress om mani padme hum httpAddress,Sympathy and support
2438,rt usrId damaris frick usrId taking part in #nepalearthquake health cluster meeting in kathmandu httpAddress http,Other Useful Information
2439,rt usrId you can help those affected by the devastating earthquake in nepal here httpAddress usrId,Donations and volunteering
2440,save the children staff worked hard to deliver aid on day D of #nepalquake active response httpAddress httpAddress,Donations and volunteering
2442,rt usrId D can provide a family with clean water for a httpAddress text dec to DD to donate D #nepalquake httpAddress,Donations and volunteering
2444,rt usrId donate to nepal via oxfam httpAddress,Donations and volunteering
2445,nepal earthquake hamilton s ross prince describes bleak recovery work httpAddress,Donations and volunteering
2446,the death toll from the earthquake in nepal is now above DD today as the world moves to provide httpAddress,Affected individuals
2451,#nepal earthquake before the great earthquake struck hinduism devotees killed 250 00 cows httpAddress,Not related or irrelevant
2452,rt usrId hey usrId you re my httpAddress are u doing text to donate 10 for #nepalearthquake where 100 goes to charity ie unicef ? usrId,Donations and volunteering
2454,rt usrId officials are trying to contact with up to DD irish citizens in nepal which has been hit with strong aftershocks http,Affected individuals
2461,rt usrId may god bless nepal n save all the souls there who are strugglin for their lives n may the ones who lost their lives ri,Sympathy and support
2462,rt usrId D million children are in danger after httpAddress join us in helping usrId keep them httpAddress donate here httpAddress,Donations and volunteering
2463,nepal s earthquake survivors are struggling to mourn the dead former verge reporter greg sandoval has .. httpAddress usrId,Sympathy and support
2464,rt usrId nepal government not even able to manage incoming foreign aid ! httpAddress,Donations and volunteering
2465,rt usrId salute D usrId chief usrId D his grt step D #nepalquake victims httpAddress http,Affected individuals
2468,rt usrId when nepal was groaning in earthquake christian missionaries were shamelessly selling jesus httpAddress,Other Useful Information
2469,rt usrId rescuers from japan are seen in the historical centre of httpAddress by usrId httpAddress #nepalearthquake httpAddress,Donations and volunteering
2470,rt usrId buses leaving for gorakhpur carrying stranded indians from tilganga bridge near kathmandu intl airport usrId httpAddress,Affected individuals
2471,rt usrId i chose usrId to support #nepal earthquake httpAddress you can help too ! httpAddress,Donations and volunteering
2473,rt usrId in sindhupalchok alone death reaches httpAddress 90 homes destroyed desperate wait for httpAddress httpAddress #nepale,Affected individuals
2474,rt usrId dear tweeps people of nepal still need your help amplify the voices of those on the ground to help with relief httpAddress,Donations and volunteering
2475,rt usrId #watch melbourne volunteer jess smith is caught up in the #nepalearthquake and spoke to sky news from httpAddress httpAddress,Donations and volunteering
2476,httpAddress i am streaming the emergency communications from httpAddress httpAddress,Other Useful Information
2477,nepal earthquake situation makes me speechless sushmita sen i know people go on social networks to express their sadness but i httpAddress,Sympathy and support
2479,rt usrId appreciate d initiative taken by usrId to help nepal this is what makes a nation httpAddress our moral authority g,Donations and volunteering
2482,rt usrId the latest on nepal earthquake dozens arrested for looting and spreading rumors about impending big quake httpAddress,Other Useful Information
2483,nepal earthquake nine new zealanders still unaccounted for httpAddress via usrId,Affected individuals
2484,rt usrId if you have a problem with india helping nepal for whatever reasons you are a httpAddress no actually the douche is still use,Other Useful Information
2485,rt usrId we are at DD survival kits for nepal in just a few hrs my goal is 60 . let s get there soon ! httpAddress httpAddress,Affected individuals
2486,rt usrId usrId usrId emma can you have a moments silent thought for all in nepal today,Sympathy and support
2489,rt usrId visualizing the #nepalearthquake the human side of #datascience httpAddress #abdsc #bigdata #dataviz httpAddress,Other Useful Information
2490,cnnbrk httpAddress forces rescued DD people who were trapped in nepal village after earthquake httpAddress httpAddress httpAddress #srilanka,Affected individuals
2491,nepals historic architecture destroyed by earthquake httpAddress,Infrastructure and utilities
2494,rt usrId i m praying for the people who were affected by a 7.9 #earthquake in #kathmandu the pictures are really httpAddress httpAddress,Sympathy and support
2495,rt usrId my prayers with all in nepal . hope the earthquake does not leave too many httpAddress prayers w nepal,Sympathy and support
2497,rt usrId for everyone in httpAddress httpAddress,Other Useful Information
2499,usrId why can t china a stinking rich country nepal s neighbour send money aid httpAddress what about the red amry helping out eh ?,Donations and volunteering
2500,rt usrId beef masala mus b relief material for the minority communities in httpAddress sanghis wont let minorities eat in nepal httpAddress #,Other Useful Information
2501,rt usrId uk will deploy D usrId chinook helicopters to help supplies amp ; people travel quickly to and from #nepals re,Donations and volunteering
2502,rt usrId bravo usrId ! just launched and already doing grt job in uniting distressed ppl in india and nepal ! keep up t,Donations and volunteering
2503,tens of thousands of people in #nepal camped out fearful of going back to their homes in case of another httpAddress httpAddress,Affected individuals
2505,rt usrId players ahead of real madrid almeria wearing todos con nepal httpAddress httpAddress,Not related or irrelevant
2508,rt usrId cnn 7.8 magnitude earthquake slams nepal some DD dead authorities say httpAddress,Affected individuals
2510,rt usrId aftershock in kathmandu region measured 6.7 magnitude us geological survey says httpAddress,Other Useful Information
2511,rt usrId uk government giving 5m to help response to nepal earthquake which has killed more than 2 300 people httpAddress,Affected individuals
2515,new #earthquake mb 4.5 nepal magnitude mb 4.5 region nepal date time 2015 04 26 httpAddress utc httpAddress httpAddress,Other Useful Information
2516,rescue team of pakistan army highly specialized for rescue during natural disasters sent to nepal #pakarmyreliefefforts,Donations and volunteering
2518,after devastating nepal earthquake charities relay stories httpAddress,Donations and volunteering
2519,raw man rescued from building in nepal httpAddress #news,Affected individuals
2520,rt usrId #nepalquake total DD tremors in last DD httpAddress minor cracks are found on pashupatinath httpAddress #earthquakeagain on 1,Infrastructure and utilities
2521,#kashmir better knows relief work of ndrf amp ; indian httpAddress they are not meant to hlp people but promoting amp ; accumulating httpAddress #nepalearthquake,Not related or irrelevant
2522,rt usrId #uoft extends its condolences to those in httpAddress services are available to students and staff affected httpAddress,Sympathy and support
2523,rt usrId our good friends at usrId are donating 10 of revenue today to earthquake relief in httpAddress go get an ahi burger and,Donations and volunteering
2524,israaid emergency relief for earthquake struck nepal httpAddress,Donations and volunteering
2526,god bless httpAddress let us pray for the victims of this httpAddress httpAddress,Sympathy and support
2527,rt usrId stibo systems supporting victims of #nepal earthquake httpAddress usrId,Donations and volunteering
2528,techbytes tech giants lend a hand after nepal earthquake disaster abc news httpAddress #technology,Donations and volunteering
2529,rt usrId ramdev baba will adopt DD children nepal who have lost their httpAddress we thank patanjali for their immense httpAddress,Donations and volunteering
2530,itar tass eng russian rescue team arrives in nepal kathmandu april 29 . httpAddress a team of rescuers and httpAddress httpAddress,Donations and volunteering
2531,too soon ? oh my harry reid says gop budget is no more balanced than the earthquakes theyve had in nepal httpAddress,Not related or irrelevant
2532,#nepal death toll now over 4 00,Affected individuals
2533,#nepal death toll now over 4 00,Affected individuals
2534,this tiny baby in nepal was miraculously rescued from rubble and survived the earthquake by natashanoman httpAddress via usrId,Affected individuals
2535,noticias sin the latest on nepal quake thousands try to leave kathmandu thousands line up at bus stations in kathmandu in bid httpAddress,Affected individuals
2536,rt usrId nepal on war footing as quarter of population hit by quake httpAddress,Other Useful Information
2537,rt usrId #nepalearthquake #sewaa from #gurudwaraamritsar sahib amp ; others #langar amp ; materials f f 3 usrId usrId httpAddress,Other Useful Information
2541,rt usrId still hearing from friends and family ! sad to hear dharara tower is httpAddress #nepal #nepalearthquake #earthquake,Infrastructure and utilities
2543,hundreds dead as httpAddress earthquake strikes nepal a powerful earthquake measuring 7.9 on the richter httpAddress httpAddress,Affected individuals
2544,rt usrId it s terrible in sankhu DD km from httpAddress many bodies still under httpAddress unstable buildings difficult to rescue http,Affected individuals
2545,race against time ! people are still trapped inside ! httpAddress #nepal #kathmandu #earthquake #pleasedonate generously !,Affected individuals
2548,rt usrId usrId usrId another #soulvultures #nepalearthquake httpAddress,Other Useful Information
2549,rt usrId looking to help #nepalquake victims ? usrId is already working there and can use your httpAddress httpAddress,Donations and volunteering
2550,rt usrId impossible to keep up with rising death toll from nepal httpAddress links to ongoing coverage httpAddress,Affected individuals
2551,rt usrId india s response was like extending a blank cheque nepal httpAddress outlook wires,Donations and volunteering
2552,rt usrId httpAddress bbc marr discuss nepal in terms of risks to everest climbers and httpAddress no mention of httpAddress,Other Useful Information
2554,rt usrId thoughts and prayers out to the nepal earthquake victims f c #prayfornepal,Sympathy and support
2555,nepal tragedy lenskart botches but indian telcos amp ; startups extend genuine help ! httpAddress #tech #gadgets,Donations and volunteering
2556,rt usrId still can t believe what i witnessed in #nepalquake httpAddress history crumbling a nation in httpAddress httpAddress,Infrastructure and utilities
2559,rt usrId pls rt our team in nepal is working around the clock to provide assistance in the aftermath of the #nepalearthquake https,Donations and volunteering
2560,no one has come nepal villagers wait for aid to flow beyond the capital world news the guardian httpAddress,Donations and volunteering
2562,good design helps japan with earthquakes #nepal httpAddress,Other Useful Information
2563,usrId usrId last night kanwal was on d toilet in nepal when that tiny earthquake httpAddress thought it was just he amp ; his ass fumes,Not related or irrelevant
2565,rt usrId hi friends please help those affected by the #nepalearthquake donate if you can to the usrId via usrId h,Donations and volunteering
2566,rt usrId my thoughts and prayers go to victims families and friends of the earthquake in httpAddress i am available to httpAddress #prayfornepal,Sympathy and support
2567,rt usrId for generations the brave gorkhas have defended httpAddress india goes all out to pay back that httpAddress #nepalearthquake,Other Useful Information
2569,nepal quake survivors clash with riot police un seeks 415 mn zee news via world google news .. httpAddress,Donations and volunteering
2570,rt usrId list of urgent relief material httpAddress plz help #nepalearthquake #nepalquakerelief httpAddress,Donations and volunteering
2571,rt usrId foreign secretary s jaishankar confirms DD indian fatalities in nepal including D people from assam whose bodies have been h,Affected individuals
2573,rt usrId httpAddress heavy equipment for rubble removal ; helicopters for transport and access to blocked httpAddress #nepalquake httpAddress,Other Useful Information
2575,#nepalquake #unicef #unspokenechoes images courtesy usrId httpAddress,Not related or irrelevant
2576,usrId china to flatten DD mountains httpAddress usrId #nepalearthquake #wazrom httpAddress,Not related or irrelevant
2578,rt usrId prayers for the wellbeing of people in httpAddress and other earthquake affected areas #msghelpearthquakevictims,Sympathy and support
2579,a french spiderman scales #montparnassetower for nepal ! #thelocalfrance #prayfornepal #paris httpAddress,Not related or irrelevant
2580,rt usrId want to help the people of nepal ? donate at httpAddress amp ; 100 will reach our local partners on the ground ht,Donations and volunteering
2581,usrId usrId nepal is httpAddress country but gospel has been there for DD years we are praying that people turn to jesus,Not related or irrelevant
2585,4.5 storey house in sitapaila httpAddress #nepal #realestate #basobaas httpAddress,Not related or irrelevant
2586,usrId dude i was thinking that how should be a part of this and contribute to nepal httpAddress think this a good way to help,Donations and volunteering
2587,rt usrId so many after httpAddress people are still out of httpAddress hospital situation is too httpAddress #nepal #earthquake,Affected individuals
2588,rt usrId the art of living centre in kathmandu converted into a shelter httpAddress DD people who have lost their homes stayed http,Affected individuals
2589,rt usrId httpAddress sophia bush s ex dan fredinburg died following the nepal earthquake today httpAddress httpAddress,Affected individuals
2590,rt usrId reports quoting nepal police now say death toll rises to DD #nepalearthquake via usrId amp ; usrId httpAddress,Affected individuals
2591,rt usrId okhaldhunga 11 sunsari D bhojpur D solukhumbu D died so far in eastern part of nepal according to regional police,Affected individuals
2592,rt usrId lucknow up government sends DD trucks carrying relief material to the affected in #nepalearthquake httpAddress,Donations and volunteering
2593,6.7 magnitude aftershock registered in the kathmandu region of httpAddress largest aftershock recorded since saturday s earthquake usrId,Other Useful Information
2594,faced with the disaster we are httpAddress do hope nepal can get through this earth quake httpAddress cheer up !,Sympathy and support
2598,keeping our missing family in nepal in our thoughts and httpAddress sending positive httpAddress,Affected individuals
2599,rt usrId #retweet #prayfornepal o god our help is in thy name relieve #nepal by granting them thy httpAddress let them know of thy p,Sympathy and support
2600,rt usrId looking for a way to do something for survivors of #nepalquake ? join my friends usrId amp ; give lifesaving httpAddress xo httpAddress,Donations and volunteering
2601,rt usrId at least1800 confirmed dead in httpAddress happened at bad time of day when people werein buildings at schools amp ; work #msgh,Affected individuals
2602,usrId i am on my way to nepal to help rebuild a shelter for DD httpAddress could you help fund me ? thank you ! httpAddress,Donations and volunteering
2603,rt usrId nepal s pain is our pain pm usrId,Sympathy and support
2604,rt usrId my thoughts and prayers are with the proud brave people of nepal !! such a devastating tragedy !! 4 god bless !!,Sympathy and support
2605,rt usrId an earthquake with an estimated magnitude of 7.9 shook nepal on saturday near its capital katmandu httpAddress,Other Useful Information
2607,every one needs to support nepal #earthquakeagain,Donations and volunteering
2609,we must find the missing people in nepal #earthquake httpAddress,Affected individuals
2610,rt usrId dan fredinburg an engineer at google died on mount everest during the avalanche caused by the earthquake in nepal httpAddress,Affected individuals
2611,rt usrId facebook adds donate button atop news feeds to aid earthquake ravaged nepal httpAddress,Donations and volunteering
2613,quick access and useful data is what usrId was designed for and its unprecedented in the humanitarian httpAddress httpAddress,Other Useful Information
2615,just one bbc news fb post on #nepalquake from last weekend nb the page has 450k fans in nepal and 2million in india httpAddress,Other Useful Information
2618,thoughts are with the families in #nepal,Sympathy and support
2619,we ll all be praying #prayfornepal 0 stay strong and don t give up b f b httpAddress,Sympathy and support
2620,rt usrId f let s #prayfornepal,Sympathy and support
2621,rt usrId national helpline by national disaster management authority for nepal earthquake open number 011 1078 #nepalearthquake,Donations and volunteering
2623,rt usrId much more interested in nepal than fucking baltimore,Not related or irrelevant
2624,rt usrId we re on the ground responding to httpAddress donate now to help gt ; httpAddress,Donations and volunteering
2625,rt usrId thoughts and prayers are with you nepal lt ;3,Sympathy and support
2626,rt usrId immature message 7from brainless 9 aamaadmiparty at the time of httpAddress can t expect better from murder #indiawithnepal httpAddress,Not related or irrelevant
2628,rt usrId under bapuji s guidance asaram bapu ji ashram comes ahead with massive relief work for #nepal earthquake victims ! httpAddress,Donations and volunteering
2629,rt usrId news of #nepal is scary and httpAddress my deepest sympathies and condolences to all who are httpAddress,Sympathy and support
2630,nepal prime minister death toll could reach100 httpAddress,Affected individuals
2631,rt usrId if youre in #kathmandu visit siddhartha art gallery support amazing artists ! ahf art exhibition open until D may httpAddress,Not related or irrelevant
2632,there will be an event at #scsu hope for #nepal #redcross on april 27th may 1 DD at 10 00 3 00pm,Donations and volunteering
2634,crazy i was just thinkin about going to nepal and they have a massive httpAddress,Other Useful Information
2635,riot police battle to contain crowds trying to leave kathmandu httpAddress #civil vision,Affected individuals
2636,so thankful this week for access to a working flushing toilet something that can t be taken for granted even on a normal httpAddress #nepalquake,Not related or irrelevant
2637,rt usrId a woman breastfeeds her baby as she sits amongst the rubble of her house in #majuwa #kathmandu #nepalearthquake #aa http,Infrastructure and utilities
2638,rescue plane reaches kathmandu with avalanche affected the earthquake killed more than 1 900 people httpAddress httpAddress,Affected individuals
2639,#inthenews ph condoles with nepal ; govt prc to send aid manila philippinesthe httpAddress httpAddress #manila #philippines,Donations and volunteering
2640,rt usrId 1st survivors of avalanche at everest base camp flown to nepal s capital ; injuries not deemed life threatening httpAddress,Affected individuals
