item_id,item,label
8293,usrId a spare D or an rt ? two 8yr olds trying to help the jam jam triathlon raising money for nepal httpAddress,Not related or irrelevant
8294,my heart is with #nepal someone some organization take me httpAddress villages ans towns outside #darjeeling and many many more we forget about,Not related or irrelevant
8296,what s that about ? httpAddress,Not related or irrelevant
8297,#empathy one of the finest of the endless nuances of #love .. httpAddress,Not related or irrelevant
8298,patient in tribulation constant in httpAddress contribute to their httpAddress #nepal #baltimore httpAddress,Not related or irrelevant
8299,u bald httpAddress #shameonu httpAddress,Not related or irrelevant
8300,don t know how i httpAddress DD people die in nepal but the prime time news is a riot in fuckin baltimore,Not related or irrelevant
8301,usrId #nepalearthquake i must say i admire all these people struggling some even smiling in such a desperate situation !,Not related or irrelevant
8304,if #israel wants to help #nepal victims thats httpAddress but they have 100s of #victims to help 1st from the #gaza httpAddress #israelinnepal,Not related or irrelevant
8305,i really hope st john likes felix s idea of donating the profits of our ep launch night to charities supporting people affected in httpAddress,Not related or irrelevant
8306,i wish i could be in nepal helping people with what i can right now,Not related or irrelevant
8308,outrageous ! this lefty journalist amp ; #8217 ;s amp ; #8216 ; lunatic amp ; #8217 ; tweet uses horrific nepal tragedy to slime israel httpAddress,Not related or irrelevant
8309,httpAddress heart weeps for you,Not related or irrelevant
8311,that s so fucking cool httpAddress,Not related or irrelevant
8316,i donated money towards the nepal disaster and i think ppl could perhaps take some time to do so too it literally took me like D minute,Not related or irrelevant
8318,and speaking of communities prayers for nepal baltimore ferguson usrId and usrId,Not related or irrelevant
8319,nepal ? what about akai gurley 28 brooklyn httpAddress 20 DD,Not related or irrelevant
8321,i am a millionaire in httpAddress,Not related or irrelevant
8322,our hearts and prayers go out to all those affected by this disaster ! #nepal httpAddress,Not related or irrelevant
8323,my attention is split between nepal and httpAddress,Not related or irrelevant
8324,may god save nepal,Not related or irrelevant
8326,#drones can help #disasters like #nepal new report via usrId httpAddress,Not related or irrelevant
8329,bit of a dumb statement really httpAddress,Not related or irrelevant
8330,yoo asia since you commies do you give shits bout httpAddress wondering if you guys could smooth it httpAddress didnt learn shit bout other gment,Not related or irrelevant
8331,i care about nepal right now because i care about my friends usrId httpAddress,Not related or irrelevant
8333,company with a big heart ! #facebook is matching donations for nepal ! #helpnepal,Not related or irrelevant
8334,dont rush to nepal to httpAddress read this first httpAddress,Not related or irrelevant
8335,seeing the news about nepal s httpAddress i m glad my dad avoided it,Not related or irrelevant
8336,best pm since independence #thankyoupm #indiawithnepal,Not related or irrelevant
8337,usrId brick organic cement or wood pellets clay httpAddress vision homi danchi in httpAddress people machine pr,Not related or irrelevant
8338,rt usrId pm modi finance min and defence min at crisis management meeting for #nepalearthquake httpAddress,Not related or irrelevant
8339,usrId usrId i wish nepal my best wishes,Not related or irrelevant
8340,usrId yeman and also nepal my brother may allah bless this world d,Not related or irrelevant
8341,i liked a usrId video httpAddress why is nepal at risk for major earthquakes ?,Not related or irrelevant
8343,also please retweet this tweet httpAddress,Not related or irrelevant
8344,usrId exactly meanwhile DD people are dead in nepal and who knows how many more affected,Not related or irrelevant
8345,prayers for nepal httpAddress,Not related or irrelevant
8346,blessings amp ; prayers for #nepal 4,Not related or irrelevant
8348,nature creature n paper but cake never eat due to egg care but earth really hungry eat amp ; fit all together t merge in httpAddress,Not related or irrelevant
8349,everyone pls keep hopes alive #nepalquake #keephopealive httpAddress,Not related or irrelevant
8350,httpAddress rt great primer from usrId on how to help and stay informed on #nepalquake httpAddress,Not related or irrelevant
8351,dont rush to nepal to httpAddress read this first httpAddress,Not related or irrelevant
8352,so proud !! #microsoft response #nepal httpAddress,Not related or irrelevant
8353,is happening our amigo is going to httpAddress cramatictravels #amigosnear #donation #help #aid httpAddress,Not related or irrelevant
8354,may god bless all give strength amp ; httpAddress httpAddress httpAddress,Not related or irrelevant
8356,usrId if this link httpAddress isn t working you can also try httpAddress,Not related or irrelevant
8357,hope this remains forever httpAddress httpAddress,Not related or irrelevant
8358,king birthday party in ned 500o dead in nepal dont seem right ? bpmitw httpAddress httpAddress via usrId,Not related or irrelevant
8360,my mom is coming home from nepal tomorrow f d f d f d f d,Not related or irrelevant
8361,father lord god please bless the families of the #nepalearthquake httpAddress put smiles back on their httpAddress httpAddress,Not related or irrelevant
8362,darrickwoodsch hoping all are well at our sister school darrick wood nepal after today s httpAddress hoping amp ; praying all ok,Not related or irrelevant
8363,the devastating #nepalquake killing over DD people underlines need for greater efforts in reducing httpAddress usrId httpAddress,Not related or irrelevant
8364,things resettled bhutanese #refugees should know in httpAddress httpAddress via usrId #bhutan #nepal #memphis #welcometomemphis,Not related or irrelevant
8365,prayers and meditations for healing innepal httpAddress,Not related or irrelevant
8366,help #nepal #earthquake survivors #connect via httpAddress httpAddress,Not related or irrelevant
8367,relieved to hear that my mate is finally back home from httpAddress he had just left everest base camp before the httpAddress such httpAddress,Not related or irrelevant
8370,great job usrId httpAddress,Not related or irrelevant
8373,in other httpAddress #nepal deserves just as much attention as flight a320 french alps crash paris shooting amp ; many others that received httpAddress,Not related or irrelevant
8374,usrId usrId can t wait till the next meetup for #nepalquakerelief ? start now with httpAddress #maptime,Not related or irrelevant
8375,bows an opportunity for these companies to prove their worth towards the greater httpAddress nepal httpAddress,Not related or irrelevant
8376,is this baltimore ? httpAddress,Not related or irrelevant
8377,#nepalearthquake will not go unnoticed ! please help those that need it the most and give them hope for a better httpAddress usrId,Not related or irrelevant
8378,httpAddress prayers for #nepal as much as you httpAddress if its possible then go and make them feel that they are on of httpAddress #prayers f,Not related or irrelevant
8379,so much more helpful than httpAddress httpAddress,Not related or irrelevant
8381,httpAddress don t be httpAddress #nepalearthquake,Not related or irrelevant
8384,#nepal #memories we can t forget you httpAddress,Not related or irrelevant
8385,stay strong nepal there is hope love and goodwill around httpAddress,Not related or irrelevant
8386,usgs httpAddress apr 27 21 27 41 utc 16km ene of nagarkot nepal httpAddress httpAddress #quake httpAddress,Other Useful Information
8388,top tags populares D #kubrick D #nepal D #video D #chiste D #mercadocorona httpAddress,Not related or irrelevant
8390,usrId yes but that s not something he should do httpAddress thousands have died in nepal and i am sure he s working on that and httpAddress,Not related or irrelevant
8391,anu from httpAddress wants to get money amp ; supplies to his family in the quake explained to him why many people got in to bitcoin,Not related or irrelevant
8392,check out usrId tweet httpAddress,Not related or irrelevant
8393,doption nepal earthquake obey three rand p,Not related or irrelevant
8396,photo prayers for souls lost #fornepal #nepalearthquake #lifeisshort #prayers #nepal httpAddress httpAddress,Not related or irrelevant
8397,urgent message from church of god international office regarding the situation in httpAddress httpAddress,Not related or irrelevant
8398,thinking of everyone in nepal s j,Not related or irrelevant
8399,miles away from india and nepal here is eygpt people applaud our pm feeling #proud #beingindian #thankyoupm,Not related or irrelevant
8400,nepal ; a httpAddress httpAddress,Not related or irrelevant
8401,thank you usrId httpAddress,Not related or irrelevant
8402,usrId usrId httpAddress this is the best joke of the season !,Not related or irrelevant
8403,photo thinking about nepal and giving my deepest httpAddress may our beautifully strong nepalese httpAddress httpAddress,Not related or irrelevant
8404,tt new zealand 09 56 httpAddress httpAddress httpAddress httpAddress httpAddress httpAddress httpAddress oliver httpAddress httpAddress,Not related or irrelevant
8405,tt ireland 21 56 httpAddress httpAddress httpAddress httpAddress httpAddress httpAddress httpAddress httpAddress power httpAddress,Not related or irrelevant
8406,think #israel mission to #nepal is pr ? ever volunteered D fly into the aftermath of natural disaster ? grow up #humanitywins usrId,Not related or irrelevant
8407,option nepal earthquake obey three rand pa,Not related or irrelevant
8408,do what he blondie say httpAddress,Not related or irrelevant
8411,nepal is a beautiful country and it s literally falling apart,Not related or irrelevant
8414,nepal a thought httpAddress,Not related or irrelevant
8415,usrId a case or two of beer for auction would be a great usrId #nepalearthquake httpAddress,Not related or irrelevant
8416,go the distance ! httpAddress,Not related or irrelevant
8417,let me get this httpAddress people trying to rebuild nepal right now while others destroying baltimore ? weird world we live in .,Not related or irrelevant
8418,web app httpAddress #mondaymotivation #whatareyouafraidof #nepalearthquake #liamisthepoolcleaner httpAddress,Not related or irrelevant
8419,httpAddress httpAddress,Not related or irrelevant
8422,big aftershocks in nepal could persist for years saturday s httpAddress quake released stress that was httpAddress httpAddress,Other Useful Information
8424,usrId g suddenly ind is looking as a global httpAddress nw httpAddress knw undr u v wil gt usrId permant httpAddress,Not related or irrelevant
8425,country profile the #languages of #nepal httpAddress,Not related or irrelevant
8427,judging by what msnbc has been like today i guess the us media s words to nepal are sorry bro you re old httpAddress,Not related or irrelevant
8428,#baltimore #nepal #kenya the world all heavy on my mind ! #purpose,Not related or irrelevant
8429,my prayers go out to all the people of nepal and anyone with love ones that where in that unbelievable httpAddress,Not related or irrelevant
8430,also the political ramifications as students opting out of state tests in large httpAddress and local reaction to devastation in httpAddress,Not related or irrelevant
8434,i love america but our culture is httpAddress more talk of bruce jenner than nepal and citizens destroy and loot to promote httpAddress #wakeup,Not related or irrelevant
8435,httpAddress charity stream by foxdrop come join us and donate if possible its for the nepal disaster thanks guys,Not related or irrelevant
8436,usrId #violence gets more coverage than nepal it s all about money and ratings and serving political agendas,Not related or irrelevant
8437,#give2heal going to #nepal httpAddress via usrId,Not related or irrelevant
8438,dj raju nepals number one dj httpAddress,Not related or irrelevant
8439,done 9 httpAddress,Not related or irrelevant
8442,calling all famous httpAddress w lotsa follows ! please let ur followers know about the candlelight vigil D nepal in trflgr sq tmr httpAddress,Not related or irrelevant
8443,i see god in httpAddress in httpAddress in httpAddress in every face i httpAddress love one another as i have loved httpAddress httpAddress,Not related or irrelevant
8444,what s in the future of #adventure #travel after the #nepalearthquake ? httpAddress httpAddress,Infrastructure and utilities
8445,looking at an official death toll list by httpAddress sindhupalchok has been hit hardest higher no . dead than httpAddress #nepalearthquake,Other Useful Information
8447,usrId usrId many thanks,Not related or irrelevant
8449,prayers for nepal and httpAddress,Not related or irrelevant
8450,omg really ? where s the corroborating facts please ? httpAddress,Not related or irrelevant
8452,mt . everest hikers caught in deadly avalanche triggered by the httpAddress usrId on #worldnewstonight httpAddress,Not related or irrelevant
8453,why does usrId today give D pages to the westerners stuck on everest but very little about the rest of #nepal ? only day D . if it was httpAddress,Not related or irrelevant
8454,dnepal but now look at nepal rn e 0 httpAddress,Not related or irrelevant
8455,nepal information platform httpAddress,Other Useful Information
8456,nepal s other disaster its politics httpAddress,Other Useful Information
8457,big aftershocks in nepal could persist for years saturday s httpAddress quake released stress that was building for DD years httpAddress,Other Useful Information
8461,thank you usrId .. httpAddress,Other Useful Information
8462,welcome home ! httpAddress httpAddress,Not related or irrelevant
8463,holy httpAddress httpAddress,Not related or irrelevant
8464,this is really really really httpAddress httpAddress is media keeping it going #baltimoreriots httpAddress,Not related or irrelevant
8466,cow farts destroy ancient temples httpAddress,Not related or irrelevant
8468,tragedies in nepal amp ; indon have correctly bumped #turc out of httpAddress usrId pulled their journo off #turc to do nepal related story,Not related or irrelevant
8469,companies keep approaching us about using uavs in disaster response i m sure they can help but not for everyone httpAddress,Not related or irrelevant
8470,tried to run my car on httpAddress story short it didnt work httpAddress,Not related or irrelevant
8472,who gives a fuck about what amber rose and bruce jenner are httpAddress there was just a giant earthquake in nepal and no one seems to care,Not related or irrelevant
8474,nepal earthquake obey three rand paul exp,Not related or irrelevant
8475,trending #baltimoreriots #mondaymotivation #thebestcureforboredomis #londonmarathon bournemouth nepal #extremerules amber rose mondawmin,Not related or irrelevant
8476,the daily links baltimore nepal and the undefeated from baltimore city paper freddie gray protests the httpAddress httpAddress,Not related or irrelevant
8477,earhquake in httpAddress riots in httpAddress i hope kendall jenner is httpAddress,Not related or irrelevant
8478,#prayfornepal #help #nepal httpAddress,Not related or irrelevant
8479,thinking of the people in nepal 4 c,Not related or irrelevant
8482,near 4k deaths from #nepalearthquake and all the talk is about bruce httpAddress not httpAddress not even httpAddress smh,Not related or irrelevant
8483,#nepalquake may god be with httpAddress,Not related or irrelevant
8484,nobody cares about nepal but y all tweeting about #pray4baltimore ?,Not related or irrelevant
8485,say a prayer for nepal nearly 4 00 dead #earthquake #aftershocks,Not related or irrelevant
8486,fr usrId at amp ; t makes calling amp ; texting to nepal free at amp ; t has just announced that they will be httpAddress httpAddress #technews,Other Useful Information
8487,dont rush to nepal to httpAddress read this first claire bennett httpAddress,Other Useful Information
8488,may god be with baltimore and may god be with nepal right httpAddress,Not related or irrelevant
8490,usrId wassup dear ? did u heard abt those tremors in nepal and india httpAddress also took place in my city,Not related or irrelevant
8491,props to these incredible usrId streamers ! what a charitable bunch of folks ! lt ;3 httpAddress,Not related or irrelevant
8492,to everyone in #kathmandu httpAddress,Not related or irrelevant
8494,i cannot emphasize how much i appreciate social media right now #nepal contd 1,Not related or irrelevant
8495,click here to download the find unfollower app httpAddress #bestfandomca2015 start fans #bachelorette #gewitter #nepal #tpmp,Not related or irrelevant
8497,fave for D respect nepal earthquake rt for D respect baltimore looting important u can choose only httpAddress,Not related or irrelevant
8498,prayers for #nepal and httpAddress,Not related or irrelevant
8500,httpAddress listening to in the market httpAddress janet parshall amp ; hearing updates on nepal baltimore amp ; saeed abedini amp ; other americans in httpAddress,Not related or irrelevant
8501,#nepal . i lovr you,Not related or irrelevant
8502,#nepal tibet may be in conflict with muslim ideals but they are human beings too under oppression from httpAddress httpAddress,Not related or irrelevant
8504,you make me proud louis love you and your kind heart httpAddress,Not related or irrelevant
8505,clintonfoundation do u think u can spare some of tht charitable skim salaries travel bonuses amp ; send it to nepal ? #specialreport,Not related or irrelevant
8506,we are christians by our love helpnepal ! httpAddress,Not related or irrelevant
8509,httpAddress moment before .. #earthquake #kathmandu httpAddress,Infrastructure and utilities
8511,big aftershocks in nepal could persist for years saturday s httpAddress quake released stress that was httpAddress httpAddress,Not related or irrelevant
8512,attn usrId home phone amp ; usrIdbusiness customers all calls to #nepal are free through httpAddress more httpAddress,Not related or irrelevant
8513,sweetest little crumpet ever httpAddress,Not related or irrelevant
8514,latest satellite image of nepali sky httpAddress auto tweet #weather httpAddress #satimage #nepal httpAddress,Other Useful Information
8515,usrId 9 million from httpAddress to nepal and a 50 billion nuclear bomb signing bonus to httpAddress,Not related or irrelevant
8516,sorry for late httpAddress i fell asleep ! ahh thank god for you httpAddress poor those people in nepal httpAddress usrId,Not related or irrelevant
8517,i really really wanna go to nepal,Not related or irrelevant
8518,god bless nepal ! d 5 f,Not related or irrelevant
8519,plibersek should do more to help our farmers ! australia should do more to help nepal plibersek says httpAddress via usrId,Not related or irrelevant
8520,jesus christ !! stop being so fucking perfect d httpAddress,Not related or irrelevant
8522,httpAddress httpAddress,Not related or irrelevant
8523,i have so many social justice issues to yell about httpAddress #sb268 #baltimoreriots #nepalearthquake,Not related or irrelevant
8524,usrId holy quran thou shall see the result of your deeds ! #nepal #earthquake is allah s wrath ! #repentnow httpAddress,Not related or irrelevant
8527,thank you so muchy toure amazing httpAddress,Not related or irrelevant
8528,another one ? 8 httpAddress,Not related or irrelevant
8533,tuesday s national newspaper front pages httpAddress #uk #nepal #news,Not related or irrelevant
8534,usrId sir plz do support to nepal as much as u can . if u want u can re build whole httpAddress do support,Not related or irrelevant
8535,usrId the bruce jenner news is a step towards de stigmatising an entire community ? its httpAddress can t compare it to nepal like that,Not related or irrelevant
8536,thank you usrId httpAddress,Not related or irrelevant
8538,so nice to see the city of baltimore come together and do whatever the hell it takes to get their hands on food to send nepal quake victims,Not related or irrelevant
8539,our beloved ally amp ; gods chosen people rescue babies for homosexuals while leaving surrogate moms behind in the ruble httpAddress,Not related or irrelevant
8540,spit my #coffee out over this #tweet httpAddress,Not related or irrelevant
8541,#gurkha should be sent now !! #nepalearthquake usrId httpAddress,Not related or irrelevant
8542,twisted httpAddress,Not related or irrelevant
8544,changed profile picture in honour or #nepal,Not related or irrelevant
8545,usrId usrId landon chapman s article regarding the nepal tweet httpAddress httpAddress via usrId,Not related or irrelevant
8546,update httpAddress qld yoga teacher nadwa natalie alasfar is still missing after the httpAddress #9news httpAddress,Other Useful Information
8547,you re an angel httpAddress,Not related or irrelevant
8549,natural disastrous world what are you coming to ? 2 it makes me tear a bit that all these innocent people lost their lives #nepal #avalanche,Not related or irrelevant
8550,my heart aches and aches and aches httpAddress,Infrastructure and utilities
8553,i find it interesting that no one seems to care about nepal but when this happens here it will we ll expect every country to stop amp ; help,Not related or irrelevant
8554,big aftershocks in nepal could persist for years aftershocks following saturday s httpAddress quake in nepal are httpAddress,Not related or irrelevant
8555,hold on they had electricity in nepal ?,Not related or irrelevant
8557,nepal home httpAddress,Not related or irrelevant
8558,can history be rebuilt after #nepalearthquake ? httpAddress historic sites in rubble after httpAddress #nepalquake httpAddress,Not related or irrelevant
8559,nepal and christians who preach on the backs of the dead httpAddress via usrId,Not related or irrelevant
8561,father god we put or trust in u httpAddress jesus go there nepal with those suffering and give those out there helping the strength to endure thi,Not related or irrelevant
8562,ill support nepal when nepal supports us .,Not related or irrelevant
8563,prayers for #nepalearthquake,Not related or irrelevant
8564,everest avalanche inforgraphic deaths amp ; rescues via usrId httpAddress httpAddress,Other Useful Information
8565,i hope the people in nepal okay 3,Not related or irrelevant
8566,people in nepal are fighting for life amp ; mobs in baltimore are wreaking havoc on their own httpAddress lord wrap your arms around our hurting world,Not related or irrelevant
8567,i need to go to nepal,Not related or irrelevant
8569,per hbo vice not D cent of billons went D the ppl at haiti ! #haiti #nepal #savethepeople,Not related or irrelevant
8573,really worried the #nepalearthquake isn t trending as much as it should be,Not related or irrelevant
8574,considering how well usrId and usrId handled haiti i have a feeling nepal will be back on easy street in no httpAddress,Not related or irrelevant
8576,today i am thinking of nepal and baltimore 4,Not related or irrelevant
8577,locals with loved ones in nepal speak out httpAddress,Not related or irrelevant
8579,usrId tx for the follow can you ask your followers D text help to DD to give10 to the usrId #nepalearthquake appeal ? tx,Not related or irrelevant
8582,usrId faith ! god is greater ! strength brazil nepal and chile ! honey love you sweetie,Not related or irrelevant
8583,prayers go out to nepal,Not related or irrelevant
8584,mother waits for phone call from son who is hiking in nepal 28 year old midland native eric chaudhary httpAddress httpAddress nbc,Not related or irrelevant
8588,i just gave to usrId to support the nepal earthquake httpAddress join me ! httpAddress #redcross,Not related or irrelevant
8590,what a devastation in httpAddress prayers !,Not related or irrelevant
8591,peace to httpAddress peace to httpAddress be safe httpAddress,Not related or irrelevant
8592,most ironic tweet of DD even possibly of all time usrId source httpAddress #newworldnextweek #nepalearthquake,Not related or irrelevant
8593,if you are a united frequent flyer member you can donate to the red cross for nepal amp ; earn miles too ! httpAddress httpAddress,Other Useful Information
8594,state httpAddress #ids #2 #americans #killed #in #nepal #quake httpAddress p2 httpAddress,Not related or irrelevant
8595,usrId stay away from this nepal tl gt ; show some httpAddress,Not related or irrelevant
8596,what a heartless httpAddress httpAddress,Not related or irrelevant
8597,gca management and staff have watched with much sadness the tragic events that have occurred in nepal httpAddress httpAddress,Not related or irrelevant
8599,god help nepal !,Not related or irrelevant
8600,that s your main concern ? what is wrong with you ? httpAddress,Not related or irrelevant
8601,don t give prayers to nepal give money you lazy religious httpAddress,Not related or irrelevant
8603,usrId usrId nothing as bad as this one would hope ! httpAddress httpAddress,Not related or irrelevant
8604,really brautiful !! thank you so much httpAddress,Not related or irrelevant
8605,i am shuddering that my mom was so close to the area httpAddress,Other Useful Information
8606,just donated usrId #nepalearthquake 5 is all it takes ! usrId did it ! so can you !,Not related or irrelevant
8607,share the love for #nepal httpAddress,Not related or irrelevant
8609,post earthquake imagery for tracing in nepal httpAddress via usrId,Other Useful Information
8611,prayers f e httpAddress,Not related or irrelevant
8612,how about no selfies ? httpAddress,Not related or irrelevant
